Input.hotel_name,Input.hotel_address,Input.p-slot0,Input.p-slot1,Input.p-slot2,Input.p-slot3,Input.p-slot4,Input.p-slot5,Input.r-slot0,Input.r-slot1,Input.r-slot2,Input.r-slot3,Answer.turn_01_agent,Answer.turn_02_customer,Answer.turn_03_agent,Answer.turn_04_customer,Answer.turn_05_agent,Answer.turn_06_customer,Answer.turn_07_agent,Answer.turn_08_customer,Answer.turn_09_agent,Answer.turn_10_customer,Answer.turn_11_agent,Answer.turn_12_customer,Answer.turn_13_agent,Answer.turn_14_customer
Harrah's Resort Atlantic City,"777 Harrah's Blvd, Atlantic City, NJ 08401, USA",feels_upscale,has_boardwalk,feels_casual,has_casino,feels_modern,has_spa,has_floor_to_ceiling_windows_in_rooms,has_rooms_upgraded,has_water_views,has_shower_rainfall_in_rooms,"Hello, how may I help you today?","I'm looking for a weekend getaway to a casino, and would like to do a little gaming. Do you have any suggestions on casino resorts?","Well, where are you located?","I'm out of Pennsylvania, near Allentown.","OK then, if that's the case, how about Atlantic City?","I haven't been to AC in decades; sure, why not?","Excellent. In that case, I'd suggest the Harrah's Resort. It's an upscale, casual property that's been modernized. It's also right on the boardwalk, and it has a spa to help you relax in the time between gaming sessions.",I like the sound of that. How are the rooms themselves?,"Quite nice. They're fitted with floor to ceiling windows providing panoramic water views, and they've been recently upgraded with new fixtures, including rainfall showers.","Well, I'm ready to cash in then - let's make a reservation.",{},{},{},{}
Hilton Garden Inn Nashville Vanderbilt,"1715 Broadway, Nashville, TN 37203, USA",feels_contemporary,has_ballroom,feels_modern,feels_upscale,has_business_center,feels_casual,has_microwave_in_rooms,has_minifridge_in_rooms,has_sofa_bed,has_whirlpool_tub,"Hello, how may I help you?","Hi, I'm planning a conference in Nashville, could you help me find a venue? It should be near Vanderbilt, since several professors from the University will be presenting.","Of course, I can help. If you're looking for proximity to the University, I don't think that you can do much better than the Hilton Garden Inn Nashville Vanderbilt. It's an upscale, modern property with a contemporary, casual design that is less than a mile from campus.",What facilities does it have to support the conference that I need to plan?,"The property has a large ballroom that should be able to accommodate all of your meetings and presentations. Plus, there is a business center to support any presentation material production and other needs you might have.","Excellent. We'll be flying people in from all over, so we need nice accommodations. How are the rooms?","The rooms are spacious - some have sofabeds and whirlpool tubs, and they all have microwaves and minifridges.",That sounds excellent to me - I'll need to work directly with the property since this is a special event.,"Of course, let me provide their contact information so you can speak to the group sales manager.",That's just what I need - really appreciate it.,{},{},{},{}
Hilton San Diego Resort & Spa,"1775 East Mission Bay Drive, San Diego, CA 92109, USA",feels_modern,feels_upscale,feels_chic,feels_contemporary,has_bar_onsite,has_restaurant,has_balcony_in_rooms,has_coffee_in_rooms,has_minifridge_in_rooms,has_patio_in_rooms,"Hello, how may I help you?","Good day, I'm planning a trip to San Diego and am looking for guidance on a place to stay.",What kind of property are you looking for?,"This is a leisure trip, so I'd like a resort where I can really relax.","I think I know exactly what you're looking for. I'd suggest the Hilton San Diego Resort & Spa. It's a modern, upscale property right on Mission Bay, with a chic, contemporary vibe.",Sounds like a very San-Diego property to me! How are the rooms furnished - I want to have plenty of space to just hang out.,"The rooms are well-appointed, with a balcony in each to provide great views of the area, as well as a patio, a coffeemaker, and a minifridge.",How about dining and drinking establishments? San Diego is famous for SoCal cuisine and all of the craft beers available in the area.,"The property has both a restaurant and a bar onsite, so you'll definitely get a chance to taste all you'd like.","Perfect, I'll make a reservation now.",{},{},{},{}
Holiday Inn Club Vacations Smoky Mountain Resort,"404 Historic Nature Trail, Gatlinburg, TN 37738, USA",feels_relaxing,feels_casual,feels_cozy,has_childrens_club,has_fitness_center,has_game_room,has_balcony_in_rooms,has_fireplace,has_fire_pit,has_kitchen_in_room,"Hello, how may I help you today?","Hi, I'm looking for a place to take the family for a weekend getaway. I'm located in Charlotte and would like to take them to the mountains to get away from the heat this summer.","Makes perfect sense. So I'd think you're probably interested in the Smokies, since they're close by?","That's what I was thinking, definitely. My family used to go there, but I haven't been in forever.","Well if that's the case, you're due for a trip, and I think I know of the perfect place for you and your family. I'd highly recommend the Holiday Inn Club Vacations Smoky Mountain Resort in Gatlinburg. It's a cozy mountain resort with a relaxing, casual ambiance and activities for everyone.","I like the sound of that. What does it have for the kids, and for the adults?","For the adults there are all of the offerings of the surrounding mountains and city, plus a fitness center to help you get energized in the mornings. The kids will be kept busy with the children's club and game room. And at the end of the day, you can all relax outside around the fire pit.",Sounds like a match to me. What are the rooms like?,"They have full kitchens in case you'd like to cook, plus they have fireplaces and balconies for mountain views.",Say no more - let's make a reservation!,{},{},{},{}
Hooters Casino Hotel,"115 E Tropicana Ave, Las Vegas, NV 89109, USA",feels_casual,has_casino,feels_upscale,has_bar_onsite,has_resort_fees,has_fitness_center,feels_modest,has_coffee_in_rooms,has_room_service,has_rooms_upgraded,"Hello, how may I assist you today?",I'm headed to Vegas in a couple weeks and am looking for a different place than usual - I've stayed at all the big-name places on the Strip before.,"Well, are you open to a bit of a themed property?","Sure, depends on the theme I guess.",Have you stayed at the Hooters Casino Hotel?,"No, but I like the sound of this. Go on.","Yes, it's a casual casino property, with an upscale yet modest atmosphere. Delightfully Tacky, Yet Unrefined, as the official slogan goes.","Heh, I like it. What, um, amenities does the property offer?","Well, aside from the obvious, it has a bar onsite and a fitness center to keep you looking your best. The rooms have also been recently upgraded, feature coffee machines, and offer room service if you wish to eat in.",I'm sold - let's make a booking.,{},{},{},{}
Hotel del Coronado,"1500 Orange Avenue, Coronado, CA 92118, USA",feels_upscale,feels_modern,feels_contemporary,has_bar_onsite,has_spa,has_resort_fees,has_coffee_in_rooms,has_bunk_beds_in_rooms,has_minifridge_in_rooms,has_safe_in_room,"Hello, how may I help you?","Hi, I'm going to be in San Diego in a couple weeks and am looking for a property right on the Ocean. Could you provide some suggestions?","Of course. One of my favorite properties in the area is the Hotel del Coronado, a Curio Hotel by Hilton. It's right on the Pacific, next to the Naval Base and Silver Strand Beach.",Sounds like a great location. What's the feel of this property like?,"It' an upscale, modern hotel with a contemporary SoCal vibe that fits right in with the area.","Got it. What sort of amenities does the property have, other than the beach?","It has an on-site spa and a fantastic bar, as well as a lot of other resort and leisure activities. I should note, however, that there is a resort fee, but all of the activities are well worth it.",Seems fair enough. How are the rooms furnished? I'm bringing the family so I want a nice setup.,"Some of the rooms have bunk beds, so I'd highly recommend those for your kids. Plus, all rooms have coffeemakers to get you going in the morning, minifridges for leftovers, and in-room safes for your security.","Sounds like a good deal to me. Let me check with my wife, and then I'll get back to you on a reservation.","Perfect, have a great day!",{},{},{}
"Hotel ICON, Autograph Collection","220 Main St, Houston, TX 77002, USA",feels_elegant,feels_chic,has_bar_onsite,has_restaurant,has_fitness_center,has_wi_fi_free,has_coffee_in_rooms,has_minifridge_in_rooms,has_whirlpool_tub,has_shower_rainfall_in_rooms,"Hello, how may I help you?",I'm looking for a boutique-style hotel in Houston for a short trip. Could you provide recommendations?,"I have a good one in mind - the Hotel ICON, Autograph Collection. It's a chic, elegant property with a boutique feel, but all of the excellence of the Marriott brand behind it.",That's a great combination. What amenities does this hotel have on site?,"It has a restaurant and bar in the lobby, as well as a fitness center. And in order to help you stay connected and find local activities, it also offers free wi-fi to all guests.","Perfect. And the room furnishings, what are they like?","The rooms all come with coffeemakers and minifridges to help you get your day going. And to relax at the end of each day, the bathrooms have whirlpool tubs and rainfall showers.","Wow, that sounds fantastic. I'd like to proceed with a booking.","Glad to hear it, I'll just need to quickly take down some information.","Of course, let's get started.",{},{},{},{}
Hotel Kabuki,"1625 Post Street, San Francisco, CA 94115, USA",feels_elegant,feels_contemporary,feels_luxury,feels_quiet,feels_upscale,feels_modern,has_balcony_in_rooms,has_mini_bar_in_room,has_soaking_tubs_in_rooms,has_whirlpool_tub,"Hello, how may I help you?","Hi, I'm planning a trip to San Francisco and am looking for a hotel. I'd like something different from the usual chains that I stay at.","Ah, so an independent property or something unique?","Yes, exactly, something a bit different.","I have heard a lot of great things about the Hotel Kabuki. It's a unique property just west of downtown. It's an elegant, contemporary property with a modern, upscale, and luxurious decor.",Sounds intriguing - you mentioned that it was just west of downtown; is that in a pretty quiet location?,"Yes, it's a very quiet location. You won't be hearing the cable cars running all night.","Perfect, just what I was wondering. How are the rooms decorated, and what amenities do they have?","The rooms are luxuriously finished: each has a balcony for great views, a minibar for your convenience, and a whirlpool soaking tub to relax after a day out.","Fantastic, I'll provide my information so you that you can make a booking.",{},{},{},{}
Hotel Modera,"515 SW Clay St, Portland, OR 97201, United States",feels_hip,feels_contemporary,feels_chic,feels_modern,has_fitness_center,has_restaurant,has_fire_pit,has_bathroom_marble_in_rooms,has_minifridge_in_rooms,has_rooms_upgraded,"Hello, how may I help you today?","Hi, I'm planning a trip to Portland in a few weeks. I've always wanted to check out the hip food and drink scene out there.","Portland east, or Portland west?","Ah, right, I'd forgotten that the Maine version has been having a culinary boom of its own. But I mean the original, Portland, Oregon.","Hah, OK then, well I have a couple suggestions. Top of my list would be the Hotel Modera. If you're looking for hip, that's the place - it is a modern design with a chic, contemporary vibe.",Sounds like the right thing to me. What amenities does the property have?,"It has a restaurant on site, a fitness center for working off all the local cuisine, and a fire pit for enjoying those Pacific Northwest evenings.","That's absolutely fantastic. As for the rooms themselves, how are they?","They've all been recently upgraded with new finishes, including marble bathrooms. And all rooms have minifridges for storing leftovers from the restaurants you'll be visiting.",You've convinced me...let's get started on making a reservation.,{},{},{},{}
Hyatt Regency Clearwater Beach Resort and Spa,"33769, 301 South Gulfview Boulevard, Clearwater Beach, FL 33767, USA",feels_luxury,feels_elegant,feels_upscale,has_bar_poolside,has_bar_onsite,has_spa,has_balcony_in_rooms,has_room_service,has_kitchen_in_room,has_sofa_bed,"Hello, how may I help you?","I'm looking for a beach resort in the Tampa, Florida region.",Excellent - those are some of the finest beaches in the country! I know a great place - the Hyatt Regency Clearwater Beach Resort and Spa. It's a elegant luxury property with upscale furnishings.,Sounds great! What sorts of amenities does it have to really allow me to relax when I'm down there?,"Well, in addition to the beach, it has several onsite bars, including a poolside bar. It also has a spa, and offers room service in case you just wish to stay in and relax.",That's exactly what I'm looking for. How are the rooms furnished?,"The rooms are nicely decorated, and also come with a full kitchen, and a sofabed so that you can sleep the whole family. Plus, each room has a balcony for excellent sunset views.","I think that that is a great selection, sounds perfect.","I appreciate your confirmation, should I go ahead and book a reservation?","Of course, I'll provide my information now.",{},{},{},{}
Embassy Suites by Hilton Convention Center Las Vegas,"3600 Paradise Road, Las Vegas, NV 89169, United States",feels_contemporary,feels_modern,has_bar_onsite,has_free_breakfast,has_hot_tub,has_swimming_pool_indoor,has_balcony_in_rooms,has_minifridge_in_rooms,has_rooms_upgraded,has_kitchen_in_room,"Good afternoon, how may I help you today?","Hi, I'm going to Las Vegas soon and am interested in booking a hotel at or near the Hilton Convention Center. Preferably not further than 5 miles out.","Okay, hold on with me for just a second while I look that up. Are there any amenities or features you're looking for in particular?","A few of the most important things are that it has a minifridge and a kitchen in the room. I'd like to make most of my meals. Except for breakfast, I'd like to find one that offers free breakfast.","Absolutely! Would an onsite bar interest you, as well?","Oh yes, that would be great. Now that I think about it, I also need it to have a hot tub and an indoor swimming pool. I need to be able to exercise, I can't break my new year's resolutions just yet!","I hear you! What about decor, do you have any preferences?","Well, I'd really prefer something that's modern and contemporary.","I think I've found you a great match - the Embassy Suites by Hilton Convention Center Las Vegas. It's located at 3600 Paradise Road, Las Vegas, NV 89169, United States, and has the convention center right on site. It's a modern hotel and has all the amenities and features you're interested in - plus, it has balconies in every room, and you can upgrade your room if you choose to.","That sounds perfect, thank you!",{},{},{},{}
Grand Hyatt Washington,"1000 H St NW, Washington, DC 20001, USA",feels_modern,feels_elegant,feels_contemporary,feels_hip,has_bar_onsite,has_free_breakfast,has_floor_to_ceiling_windows_in_rooms,has_fireplace,has_coffee_in_rooms,has_room_service,"Good evening, how can I help you?"," Hi yes, my wife and I will be in Washington DC in a month for our anniversary trip, and I'm interested in finding an upscale hotel to stay at."," Certainly, are any things you're looking for in particular?"," My wife really likes luxury - so it has to be something modern, in addition to being luxurious. I'd like to have free breakfast and room service, as well."," Sure, hold on with me while I look up some options for you."," If it had a fireplace, that would be great as well."," Alright. The Grand Hyatt Washington looks great. Located at 1000 H St NW, Washington, DC 20001, USA - it's a modern style hotel that many guests feel is both elegant, modern, and hip. So right up your alley as far as style goes. In addition, they offer free breakfast, room service, and a warm fireplace in each room. There's also a bar on site, if your mood suits.", I like the sound of that - what about the view?," Each room has floor to ceiling windows, completing the elegant and contemporary vibe, and the hotel itself is near a scenic area known for it's views."," Sounds just like what we need. Out of curiousity, is there a coffee machine available as well?"," Yes, each room comes equipped with a coffee maker.", Great!,{},{}
Hilton Garden Inn Denver Downtown,"1400 Welton St, Denver, CO 80202, United States",feels_modern,feels_contemporary,has_business_center,feels_upscale,has_restaurant,has_convention_center,has_desk_in_rooms,has_microwave_in_rooms,has_minifridge_in_rooms,has_sofa_bed,"Good evening, how may I be off assistance to you this evening?","Hi, I'm going on a business trip soon and need to find a nice, upscale place to stay at in downtown Denver.",I'll be happy to help you out with your request. What features will you be needing?,"I need it to have a convention center and a business center, for certain.","Sure, and how about room amenities?",I always like to have a microwave and minifridge.,Let me have a look for you. You mentioned you're going to be on a business trip - do you need a desk in your room as well?,"That would be nice, yes.","How about the Hilton Garden Inn Denver Downtown? It's a modern, contemporary hotel that has both a business center and a convention center. In addition, each room has a desk as well as a microwave and minifridge.","That sounds good - how about a restaurant, is there one available inside the hotel?","Yes, there is one on-site. I'm not sure that you'll need it, but each room also has a sofa bed, too.","That sounds like what I need, thank you.",{},{}
Holiday Inn Express Philadelphia-Midtown,"1305 Walnut Street, Philadelphia, PA 19107, USA",has_breakfast_buffet,has_business_center,feels_upscale,feels_modern,has_free_breakfast,has_free_breakfast_buffet,has_coffee_in_rooms,has_desk_in_rooms,has_microwave_in_rooms,has_minifridge_in_rooms,"Hello, and how may I help you today?","Yes, I need a hotel in midtown Philadelphia. I'd prefer one that's around 2.5 to 3 stars and has free breakfast.","Absolutely, I'll be happy to help you!","Thank you. I also need it to have a business center, as well.",Alright. Are there any other amenities you need?,"It wouldn't hurt if it had free breakfast or a breakfast buffet. I'd like one with a restaurant, but it isn't mandatory.","Okay, let me have a look.",Thanks.,"How about Holiday Inn Express Philadelphia-Midtown? It's a nicely reviewed hotel with a free breakfast - actually, a free breakfast buffet, even better! They have a business center near the lobby, and a microwave and minifridge in each room. It doesn't feature a restaurant, but you'll be surprised at the things you can whip up in a microwave if you get creative!","Yeah, sounds great! What other features do the rooms have?","Well, there's a desk in each one, along with coffee, too. And the decor is modern and upscale, so you won't find any drab hotel furnishings here!",That sounds like what I'm looking for. What is the address?,"Great! It's located at 1305 Walnut Street, Philadelphia, PA 19107, USA.","Thanks, you've been very helpful."
Embassy Suites by Hilton Waikiki Beach Walk,"201 Beach Walk, Honolulu, HI 96815, USA",feels_relaxing,feels_casual,has_business_center,has_fitness_center,has_meeting_rooms,has_wi_fi_free,has_balcony_in_rooms,has_microwave_in_rooms,has_minifridge_in_rooms,has_sofa_bed,Hello this is the Embassy Suites by Hilton Waikiki Beach Walk. How can I help you? , I'm looking for a hotel to stay on business. ," Excellent! Our hotel has a business center, and has wi-fi free to help you work. It also has meeting rooms available for use. The hotel has a wonderful fitness center to work off the work stress."," It's not too uptight of a place, right? ", Not at all! The hotel feels relaxing in atmosphere. Our hotel has balcony in rooms to help you unwind after a long day. ," Thank you, I appreciate the information. ", What other questions may I answer? , Do you have the address? I need to see if it's close to where I am doing business. ," Certainly! The hotel address is 201 Beach Walk, Honolulu, HI 96815, USA. ", That looks like a good option for me. Is there dining nearby? ," Indeed there is. There are many restaurants in walking distance. If you feel like staying in for something that feels casual and taste great, the hotel has microwave in rooms, and some rooms in the hotel has minifridge in rooms. The premium offerings of the hotel has sofa beds available. ", Thank you ,{},{}
Holiday Inn Club Vacations Smoky Mountain Resort,"404 Historic Nature Trail, Gatlinburg, TN 37738, USA",feels_relaxing,feels_casual,feels_cozy,has_childrens_club,has_fitness_center,has_game_room,has_balcony_in_rooms,has_fireplace,has_fire_pit,has_kitchen_in_room,Hello this is the Holiday Inn Club Vacations Smoky Mountain Resort. How can I help you. , I'm looking for a good hotel for a vacation. Can you tell me about your hotel? ," Gladly! The hotel feels relaxing, perfect for a getaway! It feels cozy and our hotel is perfect for the winter. ", Can you tell me more about the rooms? , Of course! Each room has a balcony in rooms. It also has a fireplace and also has a fire pit. Each room also has a kitchen in room., We're traveling with a small child. Do you accommodate children? ," We are very child friendly! The hotel has a childrens club, as well as has game room. The hotel feels casual and you will not need to dress for dinner. ", Great! Any other amenities? , The hotel has a fitness center for use during your stay. , Fantastic! You've sold me. What is your address? ," 404 Historic Nature Trail, Gatlinburg, TN 37738, USA. We hope to hear from you soon to book your stay! ",{},{},{}
Courtyard Nashville Downtown,"170 4th Ave N, Nashville, TN 37219, USA",feels_contemporary,feels_modern,has_meeting_rooms,has_restaurant,has_wi_fi_free,is_historic,has_coffee_in_rooms,has_desk_in_rooms,has_minifridge_in_rooms,has_whirlpool_tub,Hello what can I help you with today.,I am going to a conference in Nashville and I need a hotel room for 3 nights. I need to check in on Friday and check out on Monday.,What amenities will you be requiring so I can search our database.,"I would prefer it to be an older hotel but upgraded so it feel more contemporary, it has to have wi-fi in the room, coffee maker with a minifridge. I also would need some type of room where I can meet a client on Saturday.","Okay let me take a look for you. Okay I found a hotel in Downtown Nasville. Courtyard Nashville Downtown is near the historic area. The listing states it is a historic hotel as well, however it has been updated recently so it feels contemporary. The listed amenities are free wifi in all the rooms, coffee makers, and mini fridges in select rooms. It also states it has a meeting room that appears to be available on the date you requested. Is that all you are needing or do you prefer other things?",Oh I would also like it to have a whirlpool tub as well as a restaurant on site so I don't have to leave the hotel for my meals.,Okay that's great. Tt appears this hotel has whirlpool tubs in most rooms and a 5 star restaurant on site.,Do the non smoking rooms have desk in there so I can work on my laptop.,"Absolutely it has a nice sized desk where you can even put your portable printer. So even though it states this hotel is historic, it has been moderized to meet everyone's current requirements. Shall I go ahead and book you for this hotel for this weekend?",Yes that would be great. Thank you so much for helping me.,{},{},{},{}
Comfort Inn Downtown Nashville-Vanderbilt,"1501 Demonbreun St, Nashville, TN 37203, USA",feels_casual,feels_relaxing,has_business_center,has_free_breakfast,has_free_parking,has_roadside_lodging,has_coffee_in_rooms,has_private_bathroom_outside_room,has_microwave_in_rooms,has_minifridge_in_rooms,how may i help you today?,id like a room somewhere in nashville that feels casual.,the Comfort Inn Downtown Nashville-Vanderbilt is described as being casual and relaxing.,can you tell me more about it?,"the property offers a business center, free breakfast, free parking, and roadside lodging.",what are the rooms like?,"the all contain coffee makers, microwaves, and mini fridges. each one has a private bathroom outside of the room.",whats the location?,"it is located at 1501 Demonbreun St, Nashville, TN 37203, USA.",sounds great!,{},{},{},{}
Crowne Plaza South Beach - Z Ocean Hotel,"1437 Collins Avenue, Miami Beach, FL 33139, United States",feels_elegant,has_business_center,has_boardwalk,has_bar_onsite,feels_luxury,feels_chic,has_balcony_in_rooms,has_microwave_in_rooms,has_rooms_upgraded,has_sofa_bed,how can i help you?,im looking for a room in miami.,"id recommend the Crowne Plaza South Beach. its address is 1437 Collins Avenue, Miami Beach, FL 33139. would that work for you?",can you describe the property to me?,"the property feels elegant, chic, and luxurious. it features a business center, boardwalk, and an onsite bar.",can you describe the rooms?,"the rooms have a balcony, microwave, and sofa bed. .",can i upgrade my room?,of course!,sounds great. please book me.,{},{},{},{}
