Input.hotel_name,Input.hotel_address,Input.p-slot0,Input.p-slot1,Input.p-slot2,Input.p-slot3,Input.p-slot4,Input.p-slot5,Input.r-slot0,Input.r-slot1,Input.r-slot2,Input.r-slot3,Answer.turn_01_agent,Answer.turn_02_customer,Answer.turn_03_agent,Answer.turn_04_customer,Answer.turn_05_agent,Answer.turn_06_customer,Answer.turn_07_agent,Answer.turn_08_customer,Answer.turn_09_agent,Answer.turn_10_customer,Answer.turn_11_agent,Answer.turn_12_customer,Answer.turn_13_agent,Answer.turn_14_customer
Embassy Suites by Hilton Convention Center Las Vegas,"3600 Paradise Road, Las Vegas, NV 89169, United States",feels_contemporary,feels_modern,has_bar_onsite,has_free_breakfast,has_hot_tub,has_swimming_pool_indoor,has_balcony_in_rooms,has_minifridge_in_rooms,has_rooms_upgraded,has_kitchen_in_room,"Hi, welcome to the Embassy Suites by Hilton Convention Center Las Vegas customer service line. How may I assist you?","Hi, I had a few questions about your hotel. Can you describe the rooms for me?","I certainly can. Each room has a balcony, minifridge and a kitchen. Our rooms have also been upgraded and are very modern.",What amenities are available at the hotel?,"Well, its a very contemporary and modern feel. We have a bar on sight and feature a swimming pool and hot tub available to our guests. Of course, you'll be treated to a free breakfast each morning as well.",That sounds nice. Where exactly are you located?,"Our address is 3600 Paradise Road, Las Vegas, NV,89169, in the United States.","Thank you, can I book a room with you now?","Certainly, if you can provide me with your name, full address, and credit card number, we can get a reservation ready right now!","Sure, my name is Joe Doe, 311 Street Road, New York, NY, 16383. I'll give you my credit card into as soon as I get my card.",{},{},{},{}
"Club Quarters Hotel, Wacker at Michigan","75 East Wacker Drive, Chicago, IL 60601, United States",feels_modern,feels_casual,has_bar_onsite,feels_contemporary,feels_relaxing,has_event_space,has_coffee_in_rooms,has_microwave_in_rooms,has_minifridge_in_rooms,has_kitchenette_in_rooms,Thank you for calling. How can I help you today.,I'm looking for advice on hotels in Chicago.,"Sure, I can help you with that. Is there anything you are looking for in particular?","As long as it's centrally located, and is modern but not snobbishly expensive.","How about the Club Quarters Hotel, Wacker at Michigan?  It is contemporary hotel that combines modern aesthetic while maintaing casual vibes.",Hmm. Sounds interesting What are the rooms like?,The rooms are relaxing and well appointed. They come with an kitchenette and are equipped with a microwave and a minifridge. Of course there is coffee supplied as well.  Are you traveling for business or pleasure?,I am going there for work.,"Well, the hotel also has event space for meetings, and there is a bar onsite for winding down with clients afterwards.",The place sounds great.,{},{},{},{}
Detroit Marriott at the Renaissance Center,"400 Renaissance Center, Detroit, MI 48243, USA",feels_relaxing,feels_contemporary,has_fitness_center,has_meeting_rooms,has_restaurant,popular_with_business_travelers,has_coffee_in_rooms,has_desk_in_rooms,has_minifridge_in_rooms,has_sofa_bed,"Good morning, my name is Angela. How may I help you today?","Hi, I'm calling from JE Financial and I'm trying to find a hotel for some colleagues and I going to a conference in downtown Detroit near the Convention Center. We're flying in from California and we'll be there for four nights. None of us have been to Detroit before, so we'll need some help finding a good place for us to work and relax while we're there.","Great, I'll be happy to help you today. I know that area well. There are lots of hotels in that area. What specifically are you looking for?","Well, I know that, speaking for myself, I want to keep up with my exercise routine and eating habits, so perhaps a place to store some healthy food.",I like to recommend the Detroit Marriott at the Renaissance Center to people who need to go to the Convention Center. It's very popular with business travelers like yourself. Plus it has a fitness center and a minifridge is included in all room so you can store whatever you'd like.,"That sounds nice. After long days of meetings, it would be good to go back to my room for a bit and relax.","Then this hotel would be perfect for you. They have recently updated the place to be more contemporary and have a relaxing touch to it. Also, if you need to meet with your co-workers, they have meeting rooms you can reserve or an on-site restaurant if you need to convene with them.","Thanks, but after spending all day with them, I'd rather just get some work done by myself in my room. And my husband and daughter may come out to visit, but we're not sure yet.","I get it, and that works too because every room has a desk in there so you can work and coffee makers if you need extra energy. If your family does come out, there is a sofa bed in there if you need one.",Thank you so much for your help today. I'd like to book that hotel. What's that address so I can send a link to my colleagues?,"Wonderful. It's the Marriott at 400 Renaissance Center in Detroit, MI 48243.",{},{},{}
Holiday Inn Resort Orlando-Lake Buena Vista,"13351 Florida 535, Orlando, FL 32821, USA",has_fitness_room,has_onsite_laundry,has_onsite_movie_theater,has_restaurant,has_meeting_rooms,welcomes_families,has_bunk_beds_in_rooms,has_balcony_in_rooms,has_coffee_in_rooms,has_minifridge_in_rooms,"Good morning, my name is Angela. How may I help you today?","Hi, my family and I are taking a long overdue vacation with some of their friends during Spring Break to Disney World. I'd prefer not to stay at one of the Disney resorts because I had a bad experience with one before. We have a five-day pass to Disney World, but we'll be out there for eight days so we'll need a place where we can keep the kids busy while we're not at the park. Preferably a resort-type property.","Okay, I'll be happy to help you. There are plenty of resorts to stay at in that area. Since you'll have children, I like to recommend the family friendly Holiday Inn Resort Orlando-Lake Buena Vista. It has bunk beds in the rooms that are always a hit with the kids. With a movie theater on site, you can drop the kids off there and perhaps take advantage of the restaurant on the property with your spouse.",That sounds lovely. I'd prefer though to just sit outside with coffee with my husband or hit up a gym. Hopefully they have one there.,"Yes, they have a fitness room. Your room will have a balcony and coffee available in all rooms, so you won't even have to leave your room! Plus with a mini fridge in each room, you can store food so you really don't have to leave.",Thank you so much. I'm really looking forward to it. It will be a nice break from working.,"Well if you ever miss working, they do have meeting rooms if you need to get work done.","That's okay. I don't plan on doing any work when I'm there. There will be lots of work to get done when we get back. Laundry, putting things away....","There is a laundry room on site, so you can get it done there before you get home.",Wonderful. I'm really excited. Thanks again for all your help. Will you please give me the address?,"Of course. It's 13351 Florida 535, Orlando, FL 32821.",{},{},{}
Comfort Inn Downtown Nashville-Vanderbilt,"1501 Demonbreun St, Nashville, TN 37203, USA",feels_casual,feels_relaxing,has_business_center,has_free_breakfast,has_free_parking,has_roadside_lodging,has_coffee_in_rooms,has_private_bathroom_outside_room,has_microwave_in_rooms,has_minifridge_in_rooms,"Hello, how can I help you today? ", I will be vacationing in Nashville for 4 days with my family and I am looking for that is convenient to downtown.," Okay, I can highly recommend the Comfort Inn Downtown Nashville - Vanderbilt. It's a casual hotel so it is perfect for families. It also has a business center if you need to tend to any work.", We really want a place where we can wind down in the evenings. How is the atmosphere? , The Comfort Inn has a very relaxing atmosphere so you do not have to worry about a wild or noisy environment during your stay. , That sounds great. Can you tell me about the room amenities? ," Sure! There is free coffee, microwave and minifridge in all of the rooms. Private bathrooms are located outside the rooms.", Great. What else does the price of the room include? , This hotel offers free breakfast so it is perfect if you need to grab a meal on your way out for the day. ," Just to make sure, this hotel is not off the beaten path, right. We would like to stay somewhere close to the main road. ", Comfort Inn offers roadside lodging so it will be very convenient for you. We also have free parking.," Wonderful, please tell me the address so that I may see on a map where it is. "," The address for Comfort Inn Downtown Nashville - Vanderbilt is 1501 Demonbreun St, Nashville, TN 37203, USA ", Thanks for your help!
Desert Palms Hotel and Suites,"631 W Katella Ave, Anaheim, CA 92802, United States",feels_relaxing,feels_cozy,has_bar_onsite,has_breakfast_buffet,feels_quaint,feels_casual,has_coffee_in_rooms,has_microwave_in_rooms,has_kitchenette_in_rooms,has_minifridge_in_rooms,"Hi there, how can I help you with your travel plans today? "," Well, I am going to be taking my grandkids to Disneyland and I wanted to find a good value Hotel. ", Sounds like fun! Would you like to stay close to the park? ," Yes. Although we are going to spend quite a bit of time at the park, we need a nice place to return to and maybe be able to fix some of our meals there. "," Great, The Desert Palms sounds almost perfect for you. It's a quaint and casual Hotel and seems to have just what you need to be able to cook a few meals. The room has a kitchenette equipped with microwave, a mini fridge and coffee maker. "," It sounds great, are there restaurants and bars nearby as well? "," Oh sure, plenty but the Hotel does have a breakfast buffet and a cozy on site bar. "," Oh that helps both in the morning getting started and returning in the evening. We'll be keeping quite busy, but I don t want to get stressed. "," Not too worry, you'll have a nice relaxing vacation staying at the Desert Palms. ", It sounds perfect for us!   ,{},{},{},{}
Fairfield Inn & Suites Gatlinburg North,"168 Parkway, Gatlinburg, TN 37738, United States",feels_relaxing,feels_casual,has_business_center,feels_upscale,has_parking,has_fitness_center,has_balcony_in_rooms,has_coffee_in_rooms,has_desk_in_rooms,has_minifridge_in_rooms,Hi there thank you for contacting us today! What can I help you with?, Hi there. I am looking for some information to book a vacation in Tennessee this coming summer.," Wonderful. Tennessee is a beautiful place, with a lot of different areas to explore. What city are you considering? Nashville is a very popular and fun place to go tourists love!"," I am looking for a relaxing and casual environment. I have been overworked, and I do not want to be around the stress of a busy big city. I will still have to get a lot of work done as well, so I need access to a business center, but still able to relax."," Great, I think Gatlinburg Tennessee would be a wonderful destination for you. It is a mountain town in eastern Tennessee. Very relaxing, with wonderful views. You would be surrounded by The Great Smoky Mountains National Park. I know you need to be able to work while on vacation. Let me search hotel options in Gatlinburg that would be a good fit. How many nights, and do you have any other accommodations I can help you with?"," It will be for 7 nights. A desk in my room would be wonderful, with a large coffee maker, and a mini fridge so I can keep working if need be. Also I will be driving, so I need to have parking."," Great, I have some wonderful options here for you that will work out with the business side of you trip. And what about for when you are not working, what are you looking to enjoy?"," It is hard to think of things when I am not working, haha! But besides being relaxing and casual, I still want a upscale feel. A fitness center is a plus. Also a balcony in my room for breaks between working.", I found a hotel that sounds quite lovely. It is very elegant and upscale. It has a beautiful outdoor patio set wit a fireplace to relax at night after working. With every accommodation you have mentioned! With the Great Smoky Mountains view surrounding you! It is sure to be a wonderful fit.," That all sounds wonderful. Thank you so much for all of the help, and finding the perfect vacation spot for me!!"," It was been my pleasure, please enjoy you trip!!",{},{},{}
Hotel Indigo San Diego-Gaslamp Quarter,"509 9th Ave, San Diego, CA 92101, USA",feels_casual,feels_upscale,feels_contemporary,has_bar_onsite,feels_chic,has_business_center,has_coffee_in_rooms,has_hardwood_floor_rooms,has_rooms_upgraded,is_airy,Good afternoon! What may I have the pleasure of helping you with today??,"Hi there. I am taking a vacation to San Diego California. I am trying to find a hotel that would be ideal for me. I have never been to California, and I am so excited!!","Wonderful, California is a beautiful state to take a vacation. Especially San Diego with it's casual but chic feel. There are a lot of sights to see as well! What type of hotel are you looking for?",I love that you said San Diego is more casual. That is what I am looking for. I would like the hotel to still be upscale though with a contemporary chic feel. Coffee in my room is a must. I can not start my day without having it instantly.,"Great, I have a few hotels in mind that sound like they would be the perfect fit for you. Any other activities or interests important to you? Are you going for fun or business?",I do have to get a small amount of work done. So a business center will be needed. But I am also coming for fun so a hotel that has a bar on site is important.,"Perfect, I have found a great fit for you. Recently upgraded contemporary rooms with breathtaking views of the city. The upgrades made the rooms nice and airy, with beautiful hardwood floor.s Also a new fun rooftop bar with a fireplace and patio seating.",Oh that sounds lovely. How much is a night stay? I am looking for 4 nights.,The hotel is Hotel Indigo San Diego Gaslamp Quarter. It is $299 a night. You will not regret you choice!!,I would like to book it. Thank you so much!,My pleasure! I hope you enjoy your stay.,{},{},{}
Embassy Suites by Hilton Los Angeles International Airport North,"9801 Airport Boulevard, Los Angeles, CA 90045, USA",feels_modern,has_business_center,feels_contemporary,has_airport_shuttle,feels_casual,has_bar_onsite,has_balcony_in_rooms,has_coffee_in_rooms,has_minifridge_in_rooms,has_microwave_in_rooms,Hello there. How can I be of assistance to you today?,"Hey, I'm going to be travelling to Los Angeles for the first time ever so I need to find a good hotel there.",LA is a great city with a lot of fabulous hotels to choose from. Is there anything specific that you're looking for?,"Something modern but also casual, like a place that I can relax and have a good time, you know?","Of course! I think that the Embassy Suites by Hilton Los Angeles International Airport North location would be a great fit. It's got a lot of modern amenities but also has a casual, relaxing feel combined with a great location!","Sounds cool, location is important. What are some of those amenities you talked about?","You beat me to it! The Embassy Suites has a balcony in the room, along with coffee, a minifridge, and a microwave. There is also a bar on site that adds to a more contemporary feel.",Sounds good. You mentioned it's near the airport. I don't really want to rent a car but I don't exactly want to walk around LA too much. Is it far?,"You're in luck! This hotel does have an airport shuttle, that can take you to and from the airport. No driving required!",Awesome. I think I forgot to mention that I'm self-employed so I may need to work with some clients while I'm away from home. Do you think this hotel is good a good fit for that?,"I believe so. The hotel is equipped with a modern business center, which should have computers and printers available at your convenience.","Awesome, that sounds really cool. Thanks so much.",I'm happy to help. I think that you're going to have a great time in LA. Is there anything else I could do for you today?,"Nope, you've been super. Thanks again!"
Four Seasons Resort Orlando at Walt Disney World Resort,"10100 Dream Tree Blvd, Orlando, FL 32836, USA",feels_chic,feels_luxury,feels_elegant,has_bar_onsite,feels_upscale,has_golf_course,has_freestanding_bathtub,has_balcony_in_rooms,has_fireplace,has_bathroom_marble_in_rooms,Thanks for chatting with me today. I want to do everything I can to find you the best hotel possible for your needs.,"Well that will be easy because I don't care. I'm going on a one-year anniversary trip with my wife to Disney World. I don't care what it looks like, but she wants it to be special.",I totally understand that! Do you mind if I ask what is she looking for in a good room?,"What isn't she looking for? I don't know, she wants a good room, that's all I know.",I think I can find something. The Four Seasons Resort Orlando at Walt Disney World Resort sounds like it might be a good choice for you.,Are you sure? That sounds kind of like it's more kid-friendly than adult-friendly.,"I hear you. Fortunately, this hotel has an elegant, upscale feel that has impressed many a customer.","Okay, yeah, that sounds a lot more like something she'd be after. What are the rooms like?","The rooms have a chic design with luxury furnishings. There is a marble bathroom with a freestanding bathtub, a balcony in room, as well as a fireplace.","A fireplace? Yeah, she would definitely love that. Anything else?",I see here that there is a bar on site. And it looks like they even have a golf course.,"A golf course? Ha! That's definitely for me. Fireplace for her, bar and golf course for me. I'm sold.",It looks like it offers a little something for everyone to enjoy!,Exactly! Thanks for your time.
Grand Wailea,"3850 Wailea Alanui Drive, Kihei, Hawaii 96753, United States",has_breakfast_continental,feels_upscale,feels_tropical,has_childrens_club,has_spa,has_onsite_club_room,has_balcony_in_rooms,has_coffee_in_rooms,has_minifridge_in_rooms,has_whirlpool_tub,"Hello there, what can I help you with today?","Hi, I'm going on vacation with my kids in Hawaii. This is their first time there and I want to make it an enjoyable experience for them.","Oh, they're going to have so much fun! Was there anything specific you were looking for?","Not specific, exactly. I just want to make sure it's kid friendly.",Absolutely! I have a place here that has a children's club as well as an onsite club room.,"Wow, that sounds nice! Is there something for me while they're off doing that?",Absolutely. The property also has a fantastic spa for a more tropical feel.,I love a good spa day. What are the rooms like?,"The rooms are nice. They have the standard coffee and minifridge in the rooms, but they also have a balcony and a whirlpool tub for a bit of a more upscale touch.",Oh that sounds like heaven. What about food?,I see here that it does have a continental breakfast.,"Okay, great. And what was this place called again?","It's called the Grand Wailea on the Big Island. The exact address is 3850 Wailea Alanui Drive, Kihei, Hawaii, zip code 96753.",Super! Thanks so much!
Hard Rock Hotel Palm Springs,"150 S Indian Canyon Dr, Palm Springs, CA 92262, USA",feels_luxury,feels_modern,feels_elegant,feels_contemporary,feels_upscale,has_bar_onsite,has_fireplace,has_coffee_in_rooms,has_balcony_in_rooms,has_mini_bar_in_room,Hello. What can I do for you today?,"I'm looking for a room in Palm Springs, CA, with an elegant, luxurious feel. Do you have anything like that?","We definitely do. The Hard Rock Hotel Palm Springs located AT 150 S Indian Canyon drive has a modern, elegant feel to it.",What makes it elegant?,A fireplace and a balcony in each room helps contribute to an upscale feel and helps gives the impression of a luxury setting.,That sounds good. What else is in the rooms?,Each room comes equipped with coffee and a mini bar.,"Eh, I'm still thinking about the fireplace. What else is there?","There's also a bar on site, to help give off a contemporary vibe as well.",This place sounds perfect for me. I like it a lot.,I'm so glad I could be of assistance for you today. Is there anything else I can help you with?,"Nope. You said that it was located on S Indian Canyon drive, right?","Correct, the full address is Hard Rock Hotel Palm Springs, 150 S Indian Canyon Dr, Palm Springs, California, 92262.",Awesome. I'll make sure to jot that down. Thanks again!
Harrah's Cherokee Casino Resort,"777 Casino Drive, Cherokee, NC 28719, USA",feels_upscale,great_views,has_spa,has_fitness_center,has_swimming_pool_indoor,has_swimming_pool_outdoor,has_coffee_in_rooms,has_microwave_in_rooms,has_minifridge_in_rooms,has_whirlpool_tub,"Good afternoon, what can I assist you with today?","Hi, I'm going to be travelling to Cherokee, North Carolina. I'm from up north, so I really want to do a lot of swimming while I'm there.","I can definitely help with that! I have a place here that has not just an outdoor swimming pool, but an indoor pool as well.","Oh, that's good. Never can control the weather, can we?","Nope, but we can work around it! This place also has a bit of an upscale feel, with a full spa and a fitness center.","Oh, I do love a good spa day. What's the surrounding area like?","It's located around the casino area, but it's still able to boast some great views.",That's good to know. What are the rooms like? Standard?,"Yup! They feature all your classic amenities like a microwave, coffee, minifridge, and even a whirlpool tub.",Oh those are nice. I really like the sound of this place. What's the name of it again?,"It's the Harrah's Cherokee Casino Resort located at 777 Casino Drive, Cherokee, zip code 28719.",A casino resort sounds awesome. I can't wait!,It definitely sounds like you're going to have a blast! Is there anything else I can help you with today?,"Nope, you've covered it all. Thanks so much!"
Harrah's Resort Atlantic City,"777 Harrah's Blvd, Atlantic City, NJ 08401, USA",feels_upscale,has_boardwalk,feels_casual,has_casino,feels_modern,has_spa,has_floor_to_ceiling_windows_in_rooms,has_rooms_upgraded,has_water_views,has_shower_rainfall_in_rooms,Good morning! What can I assist you with today?,Hello! Me and the wife are headed to Atlantic City and we want to go all out. Give me the best place you got.,"Okay, I think I know a good place for you and the missus. Harrah's Resort Atlantic City on 777 Harrah's Boulevard is known for having an upscale feel to it.",Upscale is definitely a must here. What's it got?,"The rooms have all been upgraded to give it a more modern feel. Each room has floor to ceiling windows, and there is a rainfall shower in the bathroom.",That sounds awesome. Tell me more!,"Each room has views of the water, and there is a boardwalk around the property for you to stroll along at night if you are looking for a more casual feel.","Oh that sounds nice. Maybe get some ice cream, yeah. We definitely plan on hitting the casinos.","I think we're in luck,  then. This place has a casino on the property.",Get out? Really? A casino right on the property?,"Yup, there is also a spa on the property as well, for you and your wife to enjoy.","Well, more for my wife than me, but we'll see what happens. If we win big, who knows?","That's the Atlantic City spirit! Is there anything else I can do for you today, sir?","No thank you, you've been amazing."
Hilton Anaheim,"777 West Convention Way, Anaheim, CA 92802, USA",has_bar_onsite,feels_modern,has_bar_poolside,feels_contemporary,has_business_center,has_fitness_center,has_floor_to_ceiling_windows_in_rooms,has_rooms_upgraded,has_minifridge_in_rooms,has_wet_bar_in_rooms,Hi there! What can I help you with today?,Hey I'm going to be staying in Anaheim next week for spring break and I'm pretty picky.,"Of course, that's no problem at all! What is it you're looking for?","Okay, um, well, since it's spring break, we plan on drinking. A lot. And we don't want to risk driving or anything like that so there has to be a bar on site or don't even tell me about it.","Don't worry, no judgement from me! Let's see. The Hilton Anaheim located at 777 West Convention Way may be a good choice for you.",It has a bar on site?,"It does have a bar on site. It also has a poolside bar, as well as a wet bar and a minifridge in the room.",Oh wow that sounds perfect. Okay. What else does it have?,"The rooms have all been upgraded to have a more modern feel, and floor to ceiling windows have been added to the rooms to give off more of a contemporary vibe.","Nice, I like the sound of that. Does it have a gym?","Yes. Not only does it have a fitness center, but it also looks like it has a business center as well.","Nah, not planning on doing any business, but  thanks though. The rooms sound cool and I like the bar options.",It's great that we were able to work together to find a good option for you. Is there anything else I can help you with today?,"No thanks, I'm cool. Thank you."
