Input.hotel_name,Input.hotel_address,Input.p-slot0,Input.p-slot1,Input.p-slot2,Input.p-slot3,Input.p-slot4,Input.p-slot5,Input.r-slot0,Input.r-slot1,Input.r-slot2,Input.r-slot3,Answer.turn_01_agent,Answer.turn_02_customer,Answer.turn_03_agent,Answer.turn_04_customer,Answer.turn_05_agent,Answer.turn_06_customer,Answer.turn_07_agent,Answer.turn_08_customer,Answer.turn_09_agent,Answer.turn_10_customer,Answer.turn_11_agent,Answer.turn_12_customer,Answer.turn_13_agent,Answer.turn_14_customer
Crystal Gateway Marriott,"1700 Jefferson Davis Highway, Arlington, VA 22202, United States",has_bar_onsite,has_business_center,has_concierge,has_airport_shuttle,feels_upscale,feels_contemporary,has_coffee_in_rooms,has_desk_in_rooms,has_sofa_bed,has_wet_bar_in_rooms,"Hello, how may i help you today?",I just arrived and I have a couple of questions.,"Ok, what would you like to know?","Well, I was wondering if the hotel has in the rooms. A bed, desk?","The rooms have a desk, sofa bed, bed. They also have a wet bar and free coffee",Ok. Great. What about the rest of the hotel,"So, there rest of the hotel has a bar, as well as business center. There is also a concierge and a shuttle to the hotel",That's great. That's all I was wondering about. Thank you.,I should also mention that there is an upscale restaurant with a very contemporary feel.,"Woah, I will look into that.",I highly recommend it. I hope you have a nice stay.,Thank you,{},{}
Four Seasons Resort Orlando at Walt Disney World Resort,"10100 Dream Tree Blvd, Orlando, FL 32836, USA",feels_chic,feels_luxury,feels_elegant,has_bar_onsite,feels_upscale,has_golf_course,has_freestanding_bathtub,has_balcony_in_rooms,has_fireplace,has_bathroom_marble_in_rooms,You have reached Four Seasons Resort Orlando at Walt Disney World Resort. How may i help you.,"I am planning on coming to Orlando next month. I want this to be the trip of a lifetime, so I am looking to stay at the most luxurious place possible.","If it is luxury you want you have come to the right place. The chic design comes together beautifully, resulting in a truly elegant hotel. From the bar to the golf course, we wrote the book on upscale accommodations.",That's exactly what I want to hear. I want a picture perfect stay.,Well then you'll also love the rooms,Why is that?,Each room is the epitome of lavish living. They all feature a marble bathroom with a freestanding bathtub.,I love baths! I'm getting excited already,"You'll also love the fireplace, as well as the private balcony each room has access to.",I can't wait to get down there. Do you have availability may 3rd?,{},{},{},{}
Gaylord Texan Resort & Convention Center,"1501 Gaylord Trail, Grapevine, TX 76051, USA",feels_elegant,has_bar_onsite,has_spa,has_lake,has_event_space,has_resort_fees,has_bathroom_marble_in_rooms,has_desk_in_rooms,has_coffee_in_rooms,has_rooms_upgraded,This is Joe. Thank you for calling the Gaylord Texan Resort & Convention Center.,"Hi, I'm coming into town for a show and was looking for a place to stay.",In that case you have found the right place. We offer a unique experience that cannot be matched,Is that so? Can you provide some examples?,"Sure! Our elegant hotel, surrounded by a beautiful lake, has every amenity you can imagine. The resort fee covers unlimited access to the onsite bar, the spa, and any event spaces.",How about the rooms? What sets them apart?,To start: Check out the gorgeous marble bathrooms. There is also a huge mahogany desk if you need to work.,Is there an additional cost for that?,Nope! All the rooms are upgraded. We also provide complimentary coffee in every room,This sounds like a great place. I can't wait for the show to begin,{},{},{},{}
Grand Hyatt Washington,"1000 H St NW, Washington, DC 20001, USA",feels_modern,feels_elegant,feels_contemporary,feels_hip,has_bar_onsite,has_free_breakfast,has_floor_to_ceiling_windows_in_rooms,has_fireplace,has_coffee_in_rooms,has_room_service,Thank you for calling. How may I helpyou?,"Hi, I am coming into town, so I have a few questions about the rooms","Ok, what would you like to know?",What does your standard room offer?,"Each room comes with floor to ceiling windows, and a fireplace, truly luxuries in this city. You will also find coffee and a menu so you can order room service at any time you please.",What about the rest of the hotel. What other amenities are there?,Each morning you can start your day with our complimentary free breakfast. Then make sure to check out or unique fusion of elegant and modern contemporary architecture. If that's not your thing visit our hip onsite bar.,Those both sound like excellent ideas,"So, would you like to proceed with a reservation?","Yes I would, let me get a check.",{},{},{},{}
Grand Wailea,"3850 Wailea Alanui Drive, Kihei, Hawaii 96753, United States",has_breakfast_continental,feels_upscale,feels_tropical,has_childrens_club,has_spa,has_onsite_club_room,has_balcony_in_rooms,has_coffee_in_rooms,has_minifridge_in_rooms,has_whirlpool_tub,I hope you are having a wonderful evening. How may I help you?,"Hi, I'll be visiting Hawaii next year with the family, so I was wondering if the hotel is a good place to bring my children.","well, as a matter of fact, here at Grand Wailea, we have a children's club. We also offer a continental breakfast so they don't nag you in the morning.",I will definitely be taking advantage of that. What do you offer for adults?,"For the adults we have a spa and an onsite club room. Here you can experience the wonderful tropical weather, accompanied with upscale vibes.",That's exactly what I have been looking for. Just one thing. What is in the rooms?,"Well every morning you can start your day with some complimentary coffee. This can be sipped on your private balcony, or in the whirlpool tub. If you'd rather have a different beverage, there is also a mii-fridge.",Sounds like I'm going to have some decisions to make. I can't wait to get down there,{},{},{},{},{},{}
Hampton Inn Washington-Downtown-Convention Center,"901 6th St NW, Washington, DC 20001, USA",feels_elegant,feels_contemporary,has_business_center,has_bar_onsite,feels_modern,has_meeting_rooms,has_coffee_in_rooms,has_desk_in_rooms,has_microwave_in_rooms,has_minifridge_in_rooms,"Hello, This is Jake at Hampton Inn.", Hello Jake. I am visiting DC soon and I was thinking about staying with you. Could you tell me bout the hotel?," Well, here at Hampton Inn we offer an experience that is perfect for all kinds of travelers. The hotel itself is designed in such a way to elegantly combine contemporary and modern styling.", I saw that on the website. It looks great! I was wondering what other kind of amenities there are?, I bet! If you are looking for some fun the onsite bar is open all night. And if you need to work you will have access to a business center and meeting rooms., What about the rooms? What do they offer?," Each room comes with a fully stocked mini-fridge, and a beautiful desk if you need to get some work done. There is also a microwave and coffee so you can start your day off the right way", Wonderful. I always need my morning cup of joe, I couldn't agree more. So when will you be visiting?, I will be arriving on Wednesday,{},{},{},{}
Hilton Boston Downtown/Faneuil Hall,"89 Broad St, Boston, MA 02110, USA",has_business_center,has_bar_onsite,feels_contemporary,feels_upscale,feels_chic,feels_modern,has_bathroom_marble_in_rooms,has_desk_in_rooms,has_sofa_bed,has_wet_bar_in_rooms,"Hello, how may I assist you today?","Hi I have a few questions about your hotel. I am visiting for work, so I was wondering if you have an adequate business center.",I can assure you that we have the most modern business center possible.,Great. How about the rooms. What can I expect?,"Each room is the epitome of upscale; featuring a marble bathroom, huge mahogany desk, and full sofa bed if you have a visitor. Additionally, there is a fully stocked wet bar.",That's excellent news. Is there anything else I should know?,I would highly recommend visiting our chic onsite bar. It has a modern feel with hints of contemporary styling.,That I must see. I am a huge interior design nerd.,So let's get started on your reservation.,Just give me one second. I need to find my wallet,{},{},{},{}
Hilton Times Square,"234 W 42nd St, New York, NY 10036, USA",feels_lively,has_business_center,feels_contemporary,has_fitness_center,has_meeting_rooms,is_streamlined,has_desk_in_rooms,has_safe_in_room,has_minifridge_in_rooms,has_sofa_bed,"Happy New Year,. How may I help you?"," Hello, I am coming to New York for a business trip next month and was wondering how much your rooms are per night?", Here at Hilton Times Square we a have a few different options as far as rooms go., Oh ok. Well could you explain the difference between one and another.," Sure. Our standard rooms have a Queen bed, full bath, and large desk. For a small fee you can upgrade to  a room that has a sofa bed, a safe, and a mini-fridge.", I don't think that will be necessary. I will be by myself.," Ok.  Regardless, of what you choose you will experience the contemporary, yet lively atmosphere we offer.", What other kinds of amenities are available to me.," We make our best attempt to streamline your stay by offering all of our guests access to our fitness center, as well as our business center and several meeting rooms.", That's great. I'll definitely need the gym to unwind,{},{},{},{}
Holiday Inn Express Philadelphia-Midtown,"1305 Walnut Street, Philadelphia, PA 19107, USA",has_breakfast_buffet,has_business_center,feels_upscale,feels_modern,has_free_breakfast,has_free_breakfast_buffet,has_coffee_in_rooms,has_desk_in_rooms,has_microwave_in_rooms,has_minifridge_in_rooms,"Hello, how can I help you today?", Hi. I am looking to visit Philadelphia soon so I wanted to inquire about your hotel., Exciting! So what are you looking for?, I was hoping to stay somewhere that is both convenient and very nice.," Well you have come to the right place. Here at Holiday Inn we have an upscale hotel with every modern feature you could desire, including a business center. If you would rather work in your room a desk is provided.", That sounds like something I would be interested in, In addition we offer a free breakfast buffet each day. The free breakfast is rated top in the city. If you'd rather skip that you will find coffee in your room. As well as a microwave and mini-fridge. Everything you'd need., Your hotel does sound very convenient. How much is a two night stay?, On average it is $150 a night depending on dates. When will you be arriving., On the 4th and I will be staying for 3 nights.,{},{},{},{}
Holiday Inn Hotel and Suites Anaheim,"1240 S Walnut St, Anaheim, CA 92802, United States",has_airport_shuttle,feels_modern,has_fitness_center,has_restaurant,has_free_breakfast,has_swimming_pool_outdoor,has_coffee_in_rooms,has_desk_in_rooms,has_microwave_in_rooms,has_kitchenette_in_rooms,How may I help you?,"I will be visiting the area for a week, so I had a couple questions. What is in the room?","Every one of our rooms comes with a huge desk, coffee, microwave, and a kitchenette.",That's perfect I don't want to eat out every day.,"Well if you do, we do offer free breakfast and a modern restaurant that just opened.",I will definitely be investigating those at some point. Anything else I should know?,"Well if you find yourself needing a break I would recommend visiting our fitness center, or outdoor swimming pool.","It would be nice to go for a relaxing swim. Speaking of relaxation, how do I get to the hotel?",I strongly suggest taking the free airport shuttle. It is the easiest and fastest way.,"Oh wow, that will definitely help me out. Thank you",{},{},{},{}
Holiday Inn Resort Orlando-Lake Buena Vista,"13351 Florida 535, Orlando, FL 32821, USA",has_fitness_room,has_onsite_laundry,has_onsite_movie_theater,has_restaurant,has_meeting_rooms,welcomes_families,has_bunk_beds_in_rooms,has_balcony_in_rooms,has_coffee_in_rooms,has_minifridge_in_rooms,"Hello, this is Mary speaking. how may I help you.","Hi, I was interested in staying at your hotel, but I wanted to check something first.",Ok. What would you like to know?,"It says here that you have quite a few amenities. Do you really have a fitness room, and movie theater?","That we do. We also have onsite laundry, meeting rooms, and a restaurant for your convenience.",That sounds amazing. What about the rooms? Are they good for families?,Yes our hotel is very welcoming to familes. In each room you will find bunk beds and balcony access.,How about a fridge? I may need one.,We have those as well. You will also find coffee in your room,Wow. This sounds like the right place for me,,{},{},{}
Holiday Inn San Antonio Riverwalk,"217 North St Mary's Street, San Antonio, TX 78205, USA",has_business_center,feels_upscale,feels_luxury,has_bar_onsite,has_fitness_room,has_restaurant,has_balcony_in_rooms,has_desk_in_rooms,has_hardwood_floor_rooms,has_minifridge_in_rooms,Thank you for calling Holiday Inn. What can I do for you?,"Hi, I am calling today to find out about your hotel. I am going to be in San Antonio for a work trip on the 4th.","Ok, we have availability that evening. What would you like to know?",Since I'll be in the area for work I need to know if I can get some work done there.,We offer all of our guests access to fully functional business center. An office away from the office.,Great. I was worried about that,"If you need a break from work we also have a large fitness center. If that's not your cup of tea visit our upscale bar, or restaurant. Both are the epitome of luxury.",I hope I have time to do that. Even to get out of the room to be honest.,"I should also mention that each room comes with hardwood floors, a mini fridge, and a beautiful desk. And last, but not least, your own private balcony.",Really? That sounds amazing,{},{},{},{}
Hotel del Coronado,"1500 Orange Avenue, Coronado, CA 92118, USA",feels_upscale,feels_modern,feels_contemporary,has_bar_onsite,has_spa,has_resort_fees,has_coffee_in_rooms,has_bunk_beds_in_rooms,has_minifridge_in_rooms,has_safe_in_room,"Hello, how may I help you this morning",I was calling to ask about what your hotel has to offer.,"Well let me start by telling you that we are an upscale hotel, that can offer you a contemporary or modern styled room depending on your preference.",Interesting. So what is the difference in price?,"The modern room is a bit pricier due to resort fees. However, that fee comes with additional perks.",Ok. What are some of those perks.,"Well to start, you will have unlimited access to the spa, as well as the onsite bar.",I could definitely see myself spending time at both of those.,"As far as the room is concerned; the modern rooms come with coffee, bunk beds, a mini fridge, and a safe.","Sounds great, those should come in handy.",So when will you be arriving?,{},{},{}
Hotel Indigo Brooklyn,"229 Duffield Street, Brooklyn, NY 11201, USA",feels_hip,has_bar_onsite,has_business_center,has_fitness_room,has_restaurant,has_wi_fi_free,has_coffee_in_rooms,has_room_service,has_rooms_upgraded,has_minifridge_in_rooms,"Hello, this is Ray. How may I help you today?",Hello Ray. I am visiting Brooklyn soon and while looking for a place to stay I found Indigo. So I was wondering how much it is a night?,Well that depends on what nights you choose to stay. Have you chosen when you're coming?,"Yes, Wednesday the third. For three nights","It appears we do have availability those nights. For $200/night. Included in the cost of the roomis free wifi, and access to the business and fitness centers. In addition you can visit the hip onsite bar and our 3 star restaurant. If you don't want to go out, you always have the option of ordering room service.",That sounds fantastic. Can I upgrade the room?,Of course. And each upgraded room comes with coffee and a mini-fridge in the room for your convenience.,Well I'm sold. Can I book now?,Definitely. Do you have a credit card handy?,I do. Let me get it out of my wallet.,{},{},{},{}
Hotel Indigo New York City - Chelsea,"127 West 28th Street, New York, NY 10001, USA",feels_upscale,has_bar_onsite,feels_hip,feels_buzzy,has_business_center,feels_contemporary,has_coffee_in_rooms,has_desk_in_rooms,has_mini_bar_in_room,has_hardwood_floor_rooms,"Thank you for calling, how may I assist you today?",I am looking for an upscale place when I visit New York. What kind of amenities does Indigo offer?,You have come to the right place. We are one of the hippest spots in the city that manages to hold on to it's contemporary roots. And the location; The city buzzes around our location,What else do you offer?,"To start, we have a newly renovated bar onsite, as well as a business center that caters to any of your needs.",What about the rooms?,"Well each room comes with gorgeous hardwood floors, and a wonderful desk. You'll also find coffee and a minibar.",This sounds like a good fit. How much is it per night?,It is around $300 for a standard room,Ok. I am going to grab my purse,{},{},{},{}
Hotel Novotel New York Times Square,"226 West 52nd Street, New York, NY 10019, USA",feels_contemporary,has_bar_onsite,feels_casual,feels_relaxing,feels_modern,feels_chic,has_room_service,has_sofa_bed,has_terrace,has_terrace_in_rooms,This is Ryan speaking,"Hi, I was looking for a place to stay. Can you tell me about your hotel?",Sure we offer visitors a relaxing stay where you can enjoy our contemporary atmosphere. We can guarantee you'll love the casual setting that combines modern architecture with elements from the past.,That sounds very interesting. What does the hotel offer in addition?,Well we just opened up a chic new bar on site.,I don't know about that I am not the biggest fan of bars.,If that's the case we always have room service available. 24/7,That's more my thing I always like to relax by myself.,Well then you'll love the private terrace that comes with each room. And in the even you have a guest you can always make use of the sofa bed.,"Wow, you have an answer for everything. Do you have availability on the 7th?",{},{},{},{}
Hyatt Centric French Quarter New Orleans,"800 Iberville Street, New Orleans, LA 70112, USA",has_business_center,has_bar_onsite,feels_modern,feels_contemporary,has_fitness_center,has_meeting_rooms,has_balcony_in_rooms,has_coffee_in_rooms,has_rooms_upgraded,has_minifridge_in_rooms,Hi. how may I help you tonight?," I had some questions about your hotel, specifically the rooms.", Ok. What would you like to know?," Since, I am coming on a business trip I am going to need to be somewhat productive. Are there any amenities to help with that?"," Of course! In each room there is coffee and a stocked mini fridge to provide you with the energy and fuel to work as hard as you may need. We also have several meeting rooms and a business center. In the event you need a break, all the rooms are automatically upgraded, so you'll have a private balcony to relax on", That does sound great. What is your favorite part of the hotel?," Personally, I love the combination of the modern and contemporary styles.", That does sound great. Is there a gym?, Yes there is a well equipped fitness center as well as an onsite bar to unwind at., I will need that at some point. Thank you for the info.,{},{},{},{}
Hyatt Regency Boston,"1 Avenue de Lafayette, Boston, MA 02111, USA",has_business_center,has_bar_onsite,feels_upscale,feels_modern,feels_contemporary,feels_luxury,has_coffee_in_rooms,has_desk_in_rooms,has_rooms_upgraded,has_room_service,"You have reach the Hyatt Boston, how may I help you today?","Hello, I was looking at hotels in the area and yours seems nice. I was wondering what amenities are included with the room?",Here at the Hyatt we offer a luxury experience. As soon as you enter the lobby you will see our beautiful contemporary architecture. If that's not your thing check out or upscale onsite bar.,"I am definitely interested in both. Quick question. I need to send a package, can you help?",Of course. We have a very modern business center open to all of our guests.,Phew. That's reassuring. How about the room? Do you offer upgrades?,"Of course. And with those upgrades come a beautiful desk, coffee to start your morning and a loaded room service menu.","Wow, that's all so convenient. When is room service available?",24/7. The kitchen does not close.,That's great. I would like to make a reservation,{},{},{},{}
Desert Palms Hotel and Suites,"631 W Katella Ave, Anaheim, CA 92802, United States",feels_relaxing,feels_cozy,has_bar_onsite,has_breakfast_buffet,feels_quaint,feels_casual,has_coffee_in_rooms,has_microwave_in_rooms,has_kitchenette_in_rooms,has_minifridge_in_rooms,Hello. Thank you for calling the Desert Palms Hotel and Suites. How can I get your fun and exciting vacation package started?,Hello. My name is Ryan and I was looking for a relaxing and cozy vacation.,Okay. What are the things you are looking for in your hotel and you room?,"Well we have a several small children. We really need a room with a kitchenette, and a fridge and a microwave. We want to save money not going out to eat as well as the headache of taking our small kids out to eat.",I understand. That makes perfect sense. I have small children myself and it can be difficult going out to eat with them and it saves you money dining in the room. We definitely have some lovely suites that can accomodate you.,Do you have a breakfast buffet as well? And coffee in the room?,"Absolutely, we have starbucks coffee and a keurig in every room. We also have a breakfast buffet from 7 am - 11 am.",Do you have a bar on the premises? We have a 12 year old child and he can watch the other kids while they sleep and we like to have a nice drink in the evening.,"Absolutely, we have a bar right on the property and it overlooks the ocean. It is beautiful and spacious and sophisticated looking.",We are really interested in a quaint hotel that is relaxing and cozy. We have several kids so we want something casual.,I absolutely have the perfect hotel for you from our properties. It is called the Desert Palms and Suites.,That sounds great. I have heard about that before.,That's sound like a great fun. It sounds like a fun situation.,Okay. When are you available to come have a fun vacation and relax.
Hampton Inn Majestic Chicago Theatre District,"22 West Monroe Street, Chicago, IL 60603, USA",feels_upscale,feels_chic,has_business_center,has_fitness_center,has_free_breakfast,has_wi_fi_free,has_coffee_in_rooms,has_desk_in_rooms,has_microwave_in_rooms,has_minifridge_in_rooms,Hello. How are you doing today? My named is Lisa. How can I get you the best hotel vacation you could the best deal we have ever offered?,Hello Lisa. I am Eric. I am looking for the best deal you can get me in Downtown Chicago.,Well Eric. I would be more than happy to help you with that. What are you must haves in a hotel?,"Well it has to be sleek, chic and upscale. I am trying to impress my lady friend. It has to include the breakfast and it must have a fitness center because we like to stay in shape.",Well Eric I have a lot of great options so you can have an excellent vacation.,Well it is not truly a vacation. It is a work meeting with a lot of free time so it is work and fun combined. So I am going to need a business center and a desk and wifi.,I understand. Well we can definitely give you the best of worlds so you can work and play.,Sounds great. Can you make sure I have a keurig in my room with a variety of coffee as well as a microwave and a minifridge. I need to eat my leftovers the next morning. Gotta to not go to far over the budget you know?,I understand. Well Eric I have the perfect hotel for you. You are going to absolutely love it.,Can you give me the website address?,Look up the Hampton Inn Magestic.,Hampton Inn? They are usually not that nice..let me look. Wow. That is beautiful. We will have a blast there. Look at that pool and it's within my budget. That is amazing. I am ready to book.,"Great Eric. The Hampton Inn Magestic Chicago Theater District is situated at 22 West Monroe Street Chicago, IL 60603 US. What dates would you like to go?",My meeting is the 3rd of July. Can you book me for like 3 days before and after. That looks like we are going have an amazing time.
Four Seasons Hotel,"57 E 57th St, New York, NY 10022, USA",feels_luxury,feels_contemporary,feels_elegant,feels_chic,has_bar_onsite,feels_upscale,has_designer_toiletries,has_bathroom_marble_in_rooms,has_room_service,has_rooms_upgraded,"Hi, how can I help you today?","Hi, I'll be heading to New York for a few days and need to book a hotel for my stay.","Absolutely, do you have preferences as to location?","Yes, I'd like to stay near midtown if possible. And I should add that I'm looking for a luxury hotel.",Great. Are there any other preferences you have so I can find the right hotel for you?,"Yes, I would like a contemporary hotel that has room service availability as well as a bar on site.","Great. I think I would recommend the Four Seasons Hotel. It is in midtown, is very luxurious and has a contemporary feel to it. It also has a bar and room service as you requested. I would add that it's an upscale hotel that is both chic and elegant at the same time.",That sounds like a good choice. How are the rooms in the hotel?,"The hotel features upgraded rooms. Additionally, the bathrooms have marble and include designer toiletries.",That sounds like the perfect hotel for me. Thanks so much for your help.,{},{},{},{}
