Phrase,Intent
That is correct. What is the address of the restaurant?,AFFIRM
That is correct. What is the address of the restaurant?,REQUEST
Do you know the phone number?,REQUEST
"No, that would be all.",THANK_YOU
"No, that would be all.",NEGATE
Is there a place to eat?,INFORM
Antioch would be great.,INFORM
I would love to eat some lobster.,INFORM
That's great and it'll work for me.,SELECT
I would love to make an appointment for one myself at 4:30 pm.,INFORM
I would love to make an appointment for one myself at 4:30 pm.,AFFIRM
"That will be great. Also, I just wanted to now pricey is it.",AFFIRM
"That will be great. Also, I just wanted to now pricey is it.",REQUEST
"Instead of the previous time, can you make it at 18:00?",INFORM
That works and fits my schedule.,AFFIRM
Thanks. That will do it for me.,THANK_YOU
Thanks. That will do it for me.,GOODBYE
What's a good place to grab a bite?,INFORM
I'm in the mood for a burger.,INFORM
Find a place in Vallejo with live music.,INFORM
Yes. Please book a table.,INFORM
Yes. Please book a table.,SELECT
1 in the afternoon.,INFORM
Thanks. I'm done for now.,THANK_YOU
Thanks. I'm done for now.,GOODBYE
I'm searching for a place to dine at.,INFORM
"I'd like for a moderate costing meal in Mountain View, preferably French.",INFORM
Can you give me their phone number?,REQUEST
What is the restaurant's location?,REQUEST
"Is there any other restaurant you recommend, preferably in SF?",INFORM
"Is there any other restaurant you recommend, preferably in SF?",REQUEST_ALTS
"Yeah, that's the one for me. I'd like to book a spot at that restaurant.",INFORM
"Yeah, that's the one for me. I'd like to book a spot at that restaurant.",SELECT
Put it for morning 10:30.,INFORM
"Yeah, that's what I want. Can you give me their phone number?",AFFIRM
"Yeah, that's what I want. Can you give me their phone number?",REQUEST
I'd like to try making a reservation once more. Put it for eleven in the morning.,INFORM
"Yeah, that's perfect for me. Do they possess live music?",AFFIRM
"Yeah, that's perfect for me. Do they possess live music?",REQUEST
No. Thank you for your assistance.,THANK_YOU
No. Thank you for your assistance.,NEGATE
I am in San Francisco.,INFORM
Something Russian would be great.,INFORM
Do they serve alcohol? What's the address?,REQUEST
That sounds good. I'd like that one.,SELECT
"Yes, please. I want to make a reservation for next Thursday.",INFORM
"Yes, please. I want to make a reservation for next Thursday.",AFFIRM
Please reserve me at 6:15 in the evening.,INFORM
"What is their contact number? Also, how expensive is their menu?",REQUEST
Thanks very much.,THANK_YOU
"No, that's it. Thanks.",THANK_YOU
"No, that's it. Thanks.",NEGATE
what can I have for breakfast,INFORM
Anyone that is burger like in nature,INFORM
San francisco is okay,INFORM
"Yes that is okay with me, I need a reservation at 1760",INFORM
"Yes that is okay with me, I need a reservation at 1760",SELECT
evening 4:45 is perfect,INFORM
That is okay with me,AFFIRM
"Thanks, thats all I want",THANK_YOU
"Thanks, thats all I want",GOODBYE
I would like to find a place to eat in Santa Rosa.,INFORM
Please find me a ramen restaurant.,INFORM
Do they play live music? And what's their phone number?,REQUEST
Could you suggest a not very costly option?,INFORM
Could you suggest a not very costly option?,REQUEST_ALTS
That would work great.,SELECT
"Yes, please make a reservation for me.",AFFIRM
Please make it at 10:45 in the morning on the 4th of this month.,INFORM
"Yes, that would be great. What's their address? And do they have live music?",AFFIRM
"Yes, that would be great. What's their address? And do they have live music?",REQUEST
"Yes, that would be great.",AFFIRM
Thanks so much! That's all for now.,THANK_YOU
Thanks so much! That's all for now.,GOODBYE
I am looking for a restaurant.,INFORM
I am looking for asian food in SFO.,INFORM
What other restaurants are there? I want to buy a drink.,INFORM
What other restaurants are there? I want to buy a drink.,REQUEST_ALTS
Do they have live music? Where are they located?,REQUEST
What other restaurants are there?,REQUEST_ALTS
I want to make a reservation there.,INFORM
I want to make a reservation there.,SELECT
I want the reservation at half past 7 in the evening.,INFORM
"No, I actually want to go on March 14th.",INFORM
"No, I actually want to go on March 14th.",NEGATE
"Actually, we are going as a group of three.",INFORM
"Actually, we are going as a group of three.",NEGATE
That is correct.,AFFIRM
I am looking for a place to grab a bite to eat.,INFORM
I'm looking for Mediterranean in Redwood City.,INFORM
Do they have alcoholic drinks?,REQUEST
"Ok, I will go with that restaurant.",SELECT
"Yes, can you please make a reservation for 17:30?",INFORM
"Yes, can you please make a reservation for 17:30?",AFFIRM
Thank you for helping me.,THANK_YOU
Thank you for helping me.,GOODBYE
I am wondering if you find me a good dining to have my food.,INFORM
I would love to have some kind of American food. Fairfield would be suitable to me.,INFORM
Do they have bar? I would prefer one which serves alcohol too. Please can you find me some restaurant offering alcohol in addition to serving American food.,INFORM
Do they have bar? I would prefer one which serves alcohol too. Please can you find me some restaurant offering alcohol in addition to serving American food.,REQUEST_ALTS
"Might be.... If you don't mind, still do you have suggestions for any other restaurant?",REQUEST_ALTS
Is it a costlier restaurant or a cheaper one? What's their prices? What's the street address of the restaurant?,REQUEST
Awesome... I would like to have my food there. Please can I make a reservation for the table at the restaurant?,INFORM
Awesome... I would like to have my food there. Please can I make a reservation for the table at the restaurant?,SELECT
Please reserve in the morning at 11:15 am.,INFORM
"Nope, please book it on 13th of this month.",INFORM
"Nope, please book it on 13th of this month.",NEGATE
Yup! That's works. Do you have phone number to reach out?,AFFIRM
Yup! That's works. Do you have phone number to reach out?,REQUEST
I am looking for somewhere to eat.,INFORM
I want a economical place that serves alcohol in Oakland.,INFORM
Gastrobar food will be perfect.,INFORM
"Do you know if they have live music? If so, where?",REQUEST
"Ok, that works for me!",SELECT
Sure! I want to make a reservation for the 11th of March.,INFORM
Sure! I want to make a reservation for the 11th of March.,AFFIRM
"Make it for 6 o""clock in the evening, for two people.",INFORM
"Great, works for me! What is their number?",AFFIRM
"Great, works for me! What is their number?",REQUEST
"Thanks so much, that's all I needed!",THANK_YOU
"Thanks so much, that's all I needed!",GOODBYE
I would like to find a restaurant in Oakland,INFORM
Fish would be great,INFORM
Can you tell me if the prices are inexpensive?,REQUEST
And is alcohol available there? May I also have their phone number?,REQUEST
"Excellent, that's perfect.",SELECT
Yes please. I would like to reserve a table.,AFFIRM
I would like it for 6:15 pm,INFORM
"Yes, that sounds great. Can you tell me if there is live music at the venue?",AFFIRM
"Yes, that sounds great. Can you tell me if there is live music at the venue?",REQUEST
I would like to attempt a reservation for evening 5:30.,INFORM
"Sure, that's perfect. May I also have the exact address for the venue?",AFFIRM
"Sure, that's perfect. May I also have the exact address for the venue?",REQUEST
"Great, thanks for your help.",THANK_YOU
"No, all set. Thanks again",THANK_YOU
"No, all set. Thanks again",NEGATE
Can you find me a restaurant?,INFORM
Look in Santa Clara. Any Southern restaurants?,INFORM
Oh I've been meaning to try that,SELECT
"Yes, book it",AFFIRM
Do they have room for two at 18:45?,INFORM
No. Let's try 11:30 am on the 8th instead,INFORM
No. Let's try 11:30 am on the 8th instead,NEGATE
Yes that's right. Where are they? Any chance they have live music?,AFFIRM
Yes that's right. Where are they? Any chance they have live music?,REQUEST
Nope not now,THANK_YOU
Nope not now,NEGATE
I am looking for a place to eat.,INFORM
I want in Burlingame.,INFORM
Some Barbecue will be prefect.,INFORM
Do they serve liquor? How pricey are they?,REQUEST
Yes that sounds good. Make a reservation for me.,INFORM
Yes that sounds good. Make a reservation for me.,SELECT
Make it at 1:15 pm,INFORM
Do they have live music? What is the contact number?,AFFIRM
Do they have live music? What is the contact number?,REQUEST
No. That doesn't work for me,NEGATE
No. Thanks a lot,THANK_YOU
No. Thanks a lot,NEGATE
Italian food in Pleasanton.,INFORM
Anything else?,REQUEST_ALTS
What's the address and contact number?,REQUEST
Any other suggestions? Something affordable?,INFORM
Any other suggestions? Something affordable?,REQUEST_ALTS
"Yes, please, on 10th of this month.",INFORM
"Yes, please, on 10th of this month.",AFFIRM
Afternoon 1:15.,INFORM
Sounds good. What's the address?,AFFIRM
Sounds good. What's the address?,REQUEST
I'm looking for a place to eat,INFORM
I'd like some Taiwanese food in SFO,INFORM
"Can you suggest some more restaurants, I no preference on price.",INFORM
"Can you suggest some more restaurants, I no preference on price.",REQUEST_ALTS
Does that restaurant server liquor?,REQUEST
May I have their contact number and address?,REQUEST
Can you suggest other restaurants?,REQUEST_ALTS
That one would be great!,SELECT
I'd like a reservation for three people at Half past 1 in the afternoon.,INFORM
Yeah that sounds great.,AFFIRM
"No, thats all thanks.",THANK_YOU
"No, thats all thanks.",NEGATE
I'd like to find a place to eat in Oakland.,INFORM
I would love to eat some African food.,INFORM
Could you give another suggestion? I would love a place with live music.,INFORM
Could you give another suggestion? I would love a place with live music.,REQUEST_ALTS
Where are they located? And do they serve liquor?,REQUEST
That works for me. I'd like to make a reservation on the 12th.,INFORM
That works for me. I'd like to make a reservation on the 12th.,SELECT
Please schedule it at 11:15 in the morning.,INFORM
"I want to try booking again, but this time on the 3rd of this month.",INFORM
"Never mind, make it for 12:30.",INFORM
"Never mind, make it for 12:30.",NEGATE
"Yup, that would be great. Are the prices above average?",AFFIRM
"Yup, that would be great. Are the prices above average?",REQUEST
Thanks so much. That'll be all for today.,THANK_YOU
Thanks so much. That'll be all for today.,GOODBYE
"I need somewhere to have dinner, can you find me a reasonably priced place to eat?",INFORM
I want something to-go.,INFORM
"I'm in Walnut Creek at the moment, please search there.",INFORM
Do they have live music? Where can I find them?,REQUEST
"Okay, that sounds great.",SELECT
"Yes thanks, please do it.",AFFIRM
"6 o""clock in the evening thanks.",INFORM
"Yes that's perfect, thanks.",AFFIRM
Thanks a lot homie.,THANK_YOU
"No, nothing at all.",THANK_YOU
"No, nothing at all.",NEGATE
I want something not very costly priced,INFORM
I need it in San Mateo,INFORM
A Diner kind of food will be good,INFORM
what is the address?,REQUEST
Yes that is good and I want a reservation at a restaurant,INFORM
Yes that is good and I want a reservation at a restaurant,SELECT
I want it at 5:45 in the evening,INFORM
yes that is good,AFFIRM
No that is all,NEGATE
No that is all,GOODBYE
I would like to go to a restaurant.,INFORM
"I want some Indian food, preferable curry. Is there any place in Newark.",INFORM
That would be fine. I would like you a reservation.,INFORM
That would be fine. I would like you a reservation.,SELECT
I prefer 7:30 in the evening.,INFORM
That sounds like a good plan.,AFFIRM
Great. You have been helpful. I do not need anything else.,THANK_YOU
Great. You have been helpful. I do not need anything else.,GOODBYE
Somewhere to eat in San Bruno. Some Latin American food is what I'm looking for.,INFORM
Any other suggestions? Specifically places that serve alcohol.,INFORM
Any other suggestions? Specifically places that serve alcohol.,REQUEST_ALTS
That's good.,SELECT
Yes I would. Next Friday for six people.,INFORM
Yes I would. Next Friday for six people.,AFFIRM
I want it on the 9th at 5:30 in the evening.,INFORM
Change the time to 6:30 in the evening.,INFORM
Change the time to 6:30 in the evening.,NEGATE
Yes that's right. Is the restaurant low priced with live music?,AFFIRM
Yes that's right. Is the restaurant low priced with live music?,REQUEST
I want to make a reservation for 2 people.,INFORM
Yes that's good.,AFFIRM
I am looking for a not very costly place to get a bite to eat and an alcoholic drink.,INFORM
Thai food would be great.,INFORM
I want Oriental food in Berkeley.,INFORM
I would like a reservation for 1.,INFORM
I would like a reservation for 1.,SELECT
I want a reservation on the 13th at 12:30.,INFORM
Will there be live music?,REQUEST
What's the number and address?,REQUEST
Thanks! I appreciate at it!,THANK_YOU
"No thanks, I'm good.",THANK_YOU
"No thanks, I'm good.",NEGATE
"Hey, can you help me find a place to eat?",INFORM
I want to eat in SF.,INFORM
I'm feeling some Szcheuan.,INFORM
Sounds good. What's their number and address?,REQUEST
"That's great, thanks.",SELECT
"Yes, please. On the 1st of this month.",INFORM
"Yes, please. On the 1st of this month.",AFFIRM
For around 11:45.,INFORM
Yes that's good. Are they expensive? Is there live music?,AFFIRM
Yes that's good. Are they expensive? Is there live music?,REQUEST
"Yes, that's good.",AFFIRM
Thanks a lot. That's everything.,THANK_YOU
Thanks a lot. That's everything.,GOODBYE
"I need somewhere to get a bite to eat, can you hook me up?",INFORM
"I want some ramen, I'm really craving it. Can you find me an afforadable place in Morgan Hill?",INFORM
"Nah, I'd rather somewhere else. Do you have another one?",REQUEST_ALTS
"Yeah, that'll be good for me.",SELECT
"Yes, please book a table for two.",INFORM
"Yes, please book a table for two.",AFFIRM
I'd like the table for afternoon 12:30 thanks.,INFORM
"No actually, I want it for three people on the 12th instead.",INFORM
"No actually, I want it for three people on the 12th instead.",NEGATE
Yeah that's perfect. Do they serve alcohol? Do they have live music?,AFFIRM
Yeah that's perfect. Do they serve alcohol? Do they have live music?,REQUEST
i want to eat at a place in mountain view preferably one that serves alcohol.,INFORM
"something cafe like, i want some reasonably priced food.",INFORM
"yes that works, place reservation next wednesday",INFORM
"yes that works, place reservation next wednesday",SELECT
1 pm,INFORM
no make it 19:00 on march 9th,INFORM
no make it 19:00 on march 9th,NEGATE
yes that works for me. is there live music? what is their number?,AFFIRM
yes that works for me. is there live music? what is their number?,REQUEST
"thank you, that will be it.",THANK_YOU
"thank you, that will be it.",GOODBYE
I'm looking for a restaurant to go to. I'd prefer a place that specializes in fish.,INFORM
"The location is Fremont, please.",INFORM
That sounds good. I need a reservation made there for one person.,INFORM
That sounds good. I need a reservation made there for one person.,SELECT
"12:30 would be good, please.",INFORM
No. Actually I need it for three people on the 14th of March.,INFORM
No. Actually I need it for three people on the 14th of March.,NEGATE
No. Can you change it to 1 pm on the 9th?,INFORM
No. Can you change it to 1 pm on the 9th?,NEGATE
Yes. Can you tell me if the restaurant is costly and do they offer live music?,AFFIRM
Yes. Can you tell me if the restaurant is costly and do they offer live music?,REQUEST
"No, I'm all set. Thank you.",THANK_YOU
"No, I'm all set. Thank you.",NEGATE
"I would like to find somewhere to eat, preferably Asian food.",INFORM
"Please search in San Mateo, price is not an issue.",INFORM
Do they have a liquor license and also do they have any live music?,REQUEST
That sounds perfect for me.,SELECT
I would like a reservation made for 1:30 pm. for 1 person please.,INFORM
I would like a reservation made for 1:30 pm. for 1 person please.,AFFIRM
"Yes that is correct, do you have their phone number?",AFFIRM
"Yes that is correct, do you have their phone number?",REQUEST
"No, that is all, thank you.",THANK_YOU
"No, that is all, thank you.",NEGATE
I want to find one in South San Francisco.,INFORM
Sushi would be perfect.,INFORM
Can you find another restaurant? I am looking for some thing with afforadable prices in San Mateo.,INFORM
Can you find another restaurant? I am looking for some thing with afforadable prices in San Mateo.,REQUEST_ALTS
Do you have any other sugggestions?,REQUEST_ALTS
"Yes, that restaurant works for me. I would like to make a reservation for 2 people.",INFORM
"Yes, that restaurant works for me. I would like to make a reservation for 2 people.",SELECT
Place a reservation for 12:15.,INFORM
No it is for 1 person at 10:45.,INFORM
No it is for 1 person at 10:45.,NEGATE
No. That was all I needed.,NEGATE
No. That was all I needed.,GOODBYE
I am in SFO for business and looking for a place to eat.,INFORM
Are there any Pakistani places?,INFORM
"Sounds good, what is their address and do they have live music?",REQUEST
"ok, I guess that would work for me. I'd like to make a reservation, please.",INFORM
"ok, I guess that would work for me. I'd like to make a reservation, please.",SELECT
"March 14th at 17:30, please.",INFORM
Please make the reservation for three people.,INFORM
Please make the reservation for three people.,NEGATE
"Thank you, that's perfect. Do they serve liquor?",AFFIRM
"Thank you, that's perfect. Do they serve liquor?",REQUEST
What is their phone number?,REQUEST
Thank you very much for the help. That is all I need.,THANK_YOU
Thank you very much for the help. That is all I need.,GOODBYE
I need somewhere to take a friend out for dinner. I would prefer if it was To-go,INFORM
I'd like it to be in San Jose,INFORM
Is there anywhere else? I will be drinking so I'd prefer a place that serves alcohol,INFORM
Is there anywhere else? I will be drinking so I'd prefer a place that serves alcohol,REQUEST_ALTS
That's perfect! I need to book a reservation for 5 people on the 7th of March.,INFORM
That's perfect! I need to book a reservation for 5 people on the 7th of March.,SELECT
Book it for four people at 6 pm,INFORM
"No, I actually want it on the 12th of this month at twelve pm.",INFORM
"No, I actually want it on the 12th of this month at twelve pm.",NEGATE
Yes that's great,AFFIRM
"No that's everything, thank you.",THANK_YOU
"No that's everything, thank you.",NEGATE
"I want to go out to eat, looking for Parisian food.",INFORM
In San Francisco.,INFORM
"Yes, that would work. Can you go ahead and make a reservation?",INFORM
"Yes, that would work. Can you go ahead and make a reservation?",SELECT
How about quarter past 11 in the morning.,INFORM
"Try booking again, but at evening 6.",INFORM
"Yes, that's it. Do they serve alcohol?",AFFIRM
"Yes, that's it. Do they serve alcohol?",REQUEST
Thanks for the help.,THANK_YOU
"Nope, that's all thanks.",THANK_YOU
"Nope, that's all thanks.",NEGATE
Hi. I'd like to find a place to eat.,INFORM
I'd like the restaurant to be in Pleasanton. I'm in the mood for some Taiwanese food.,INFORM
That's pretty expensive. I'm looking for a restaurant that's not very costly.,INFORM
That's pretty expensive. I'm looking for a restaurant that's not very costly.,REQUEST_ALTS
I went there once and it sucked. Is there anything else?,REQUEST_ALTS
What's their address?,REQUEST
"All right, I'm willing to try them.",SELECT
12 in the afternoon.,INFORM
"No, it's for one person on the 6th.",INFORM
"No, it's for one person on the 6th.",NEGATE
"Oh, darn. My friends want dinner with me. Can we make it three people at 5:15 pm?",INFORM
"Oh, darn. My friends want dinner with me. Can we make it three people at 5:15 pm?",NEGATE
"Yes, great! What's their phone number? Also, do they play live music?",AFFIRM
"Yes, great! What's their phone number? Also, do they play live music?",REQUEST
"Wow, what a waste. No, that'll be all.",THANK_YOU
"Wow, what a waste. No, that'll be all.",NEGATE
Can you find me a place to eat?,INFORM
I'd love some Izakaya type food.,INFORM
"I'd like something in a moderate price range. How about Gastrobar type food, in St. Helena.",INFORM
Do you have an address for the restaurant?,REQUEST
That would work for me.,SELECT
"Yes, make the reservation.",AFFIRM
Half past 12 in the afternoon would be good.,INFORM
"No, make it for 4 people, at 17:00.",INFORM
"No, make it for 4 people, at 17:00.",NEGATE
"No. I want the reservation on the 12th of March, for 6 people.",INFORM
"No. I want the reservation on the 12th of March, for 6 people.",NEGATE
Yes. That is what I want.,AFFIRM
I'll be out of town for a business conference and am looking for a place to eat while I'm there.,INFORM
I'd like to find a Burger in San Francisco.,INFORM
Do they serve liquor? What's the address?,REQUEST
That works.,AFFIRM
That works.,SELECT
"Yes, make it for Tuesday next week at evening 5.",INFORM
"Yes, make it for Tuesday next week at evening 5.",AFFIRM
Can you find me somewhere to eat in Dublin?,INFORM
"Chinese food and not very costly, please.",INFORM
Do bands play there?,REQUEST
"Yes, on the 7th for four people.",INFORM
"Yes, on the 7th for four people.",AFFIRM
Please reserve the table for 14:00.,INFORM
"Yes, that is perfect.",AFFIRM
Can you make a restaurant reservation for 2 people?,INFORM
Yes. What is the phone number? Can I buy alcohol there?,AFFIRM
Yes. What is the phone number? Can I buy alcohol there?,REQUEST
Can you make a reservation at a restaurant for March 9th?,INFORM
Can you change it to afternoon 1:45?,INFORM
Can you change it to afternoon 1:45?,NEGATE
Yes that isperfect.,AFFIRM
"Thank you, I'm done.",THANK_YOU
"Thank you, I'm done.",GOODBYE
"I am planning to eat in some nice place outside, can you help me to search for one place that suits me?",INFORM
"Ya, I prefer Asian food which I am always dreaming to eat and please search for me in Pleasant Hill.",INFORM
"Let me know the phone number and address of that restaurant, so that I can confirm.",REQUEST
"Yes, that is fine, please make me a reservation on Tuesday next week.",INFORM
"Yes, that is fine, please make me a reservation on Tuesday next week.",SELECT
18:45 will be fine.,INFORM
"yes, confirmed. Please check whether they offer any live music and also get the price details.",AFFIRM
"yes, confirmed. Please check whether they offer any live music and also get the price details.",REQUEST
"No, not necessary. thanks. That's all.",NEGATE
"No, not necessary. thanks. That's all.",GOODBYE
Sushi sounds good right now.,INFORM
"Somewhere affordable, that sells alcohol in SF.",INFORM
Can I call them? Is there live music?,REQUEST
Are there any other restauarnts nearby?,REQUEST_ALTS
Yes I would like to make a reservation.,AFFIRM
Lets eat at five pm.,INFORM
Actually is is for six people.,INFORM
Actually is is for six people.,NEGATE
Yes that's right. What is thier address and phone number?,AFFIRM
Yes that's right. What is thier address and phone number?,REQUEST
Thanks,THANK_YOU
Thanks,GOODBYE
"No, thanks thats all.",THANK_YOU
"No, thanks thats all.",NEGATE
I am looking for affordable priced African food.,INFORM
I am in Oakland.,INFORM
"That is perfect, and I want to make a reservation.",INFORM
"That is perfect, and I want to make a reservation.",SELECT
There will be four of us eating at afternoon 12:30.,INFORM
"Actually, I need the reservation on the 3rd of this month for three people.",INFORM
"Actually, I need the reservation on the 3rd of this month for three people.",NEGATE
"Actually, I want to make the reservation for the 14th of March at evening 5:30.",INFORM
"Actually, I want to make the reservation for the 14th of March at evening 5:30.",NEGATE
That is correct. Do they have alcohol?,AFFIRM
That is correct. Do they have alcohol?,REQUEST
I want it in SFO. Japanese food would be great.,INFORM
"Yes, that works. I want to make a reservation there.",INFORM
"Yes, that works. I want to make a reservation there.",SELECT
Make it half past 12 in the afternoon. I want it on Saturday this week. It is for one person.,INFORM
Yes that works for me. Do they have live music? How pricey is it?,AFFIRM
Yes that works for me. Do they have live music? How pricey is it?,REQUEST
I want Izakaya food in Santa Rosa.,INFORM
Could you suggest another?,REQUEST_ALTS
"Yes, I would like to reserve a table for today.",INFORM
"Yes, I would like to reserve a table for today.",AFFIRM
"Reserve it for 7 o""clock in the evening.",INFORM
"No, it is for 3 people at 1 pm.",INFORM
"No, it is for 3 people at 1 pm.",NEGATE
"No, it is for four people on the 9th.",INFORM
"No, it is for four people on the 9th.",NEGATE
"Thank you, that is all I needed.",THANK_YOU
"Thank you, that is all I needed.",GOODBYE
I'm looking for an Oriental resturant in San Anselmo.,INFORM
Okay that works for me.,SELECT
Yes I would.,AFFIRM
Make the reservation for one in the afternoon.,INFORM
No it is for five people and on the 14th of this month.,INFORM
No it is for five people and on the 14th of this month.,NEGATE
Thats right. Is it affordable? Do they serve liquor?,AFFIRM
Thats right. Is it affordable? Do they serve liquor?,REQUEST
No thats all.,THANK_YOU
No thats all.,NEGATE
I'm literally starving to death right now. Find me a place that serves like fries and maybe a burger.,INFORM
Danville. And hurry up.,INFORM
What else is there.,REQUEST_ALTS
"Yea, gotta love Dana's. Make me a reservation for just one.",INFORM
"Yea, gotta love Dana's. Make me a reservation for just one.",SELECT
