Phrase,Intent
I need a restaurant reservation.,INFORM
It has to be in San Fran.,INFORM
It'll be afternoon 12.,INFORM
I'd like Palmer's.,INFORM
Perfect. What's their cuisine type and number?,AFFIRM
Perfect. What's their cuisine type and number?,REQUEST
"Thanks, a lot. That'll do it, for now.",THANK_YOU
"Thanks, a lot. That'll do it, for now.",GOODBYE
On March 2nd we are going to celebrate my wedding anniversary. So please check for a reservation at a restaurant.,INFORM
"Yes, I prefer jannah restaurant at 4:30 pm",INFORM
It must be in SFO,INFORM
"Sorry, Please change it the 8th at 11:30",INFORM
"Sorry, Please change it the 8th at 11:30",NEGATE
"Great, thank you",AFFIRM
Thank you very much.,THANK_YOU
Thank you very much.,GOODBYE
id like to make a reservation for friday next week.,INFORM
"yes, its called marnee in San Francisco.",INFORM
id like it for 19:00.,INFORM
"yes thats right, do they have live music? how expensive it the menu?",AFFIRM
"yes thats right, do they have live music? how expensive it the menu?",REQUEST
thank you that's all for now.,THANK_YOU
thank you that's all for now.,GOODBYE
I would like to make a reservation at the restaurant Eric's.,INFORM
It's in the SF area.,INFORM
"I was thinking 17:45, for two guests.",INFORM
Yes that is perfect.,AFFIRM
"Absolutely, thank you.",AFFIRM
Thank you very much for your efforts.,THANK_YOU
"No, that will be all. Thank you very much.",THANK_YOU
"No, that will be all. Thank you very much.",NEGATE
I want to make a reservation at a restaurant.,INFORM
I want a reservation at Mcdonald's at 4:45 pm.,INFORM
I want it in SF.,INFORM
"Yes, that's works for me.",AFFIRM
Thanks you very much much. That's all I need.,THANK_YOU
Thanks you very much much. That's all I need.,GOODBYE
Hey! I would like to have dining today in the restaurant Clementine's. Please can you reserve me a table?,INFORM
Please can you make it in San Ramon.,INFORM
I would be available at 16:45.,INFORM
"Nope, Please can you reserve at Sunnyvale.",INFORM
"Nope, Please can you reserve at Sunnyvale.",NEGATE
Yup! perfect!,AFFIRM
Please can you try the booking again for 1:15 in the afternoon.,INFORM
Yup! that would work.,AFFIRM
"Nope, thanks much.",THANK_YOU
"Nope, thanks much.",NEGATE
I'm taking a client out to dinner and I want to make a dinner reservation.,INFORM
"I want a reservation for Hisui in Vacaville at, say, quarter to 8 in the evening.",INFORM
"Yes, that's what I want.",AFFIRM
"No, thanks.",THANK_YOU
"No, thanks.",NEGATE
I want to book a reservation at a restaurant.,INFORM
Look in San Fran.,INFORM
Book a table for four at Kusakabe for later today. Make the reservation for evening 6:45.,INFORM
Actually change it to March 5th in El Cerrito.,INFORM
Actually change it to March 5th in El Cerrito.,NEGATE
"No, I want you to book at Yoshio and make it for three people instead.",INFORM
"No, I want you to book at Yoshio and make it for three people instead.",NEGATE
"Yes, that sounds right. What's their number, and do they serve alcohol?",AFFIRM
"Yes, that sounds right. What's their number, and do they serve alcohol?",REQUEST
"Yes, try to make it for 18:30.",INFORM
"Yup, that's right.",AFFIRM
"Thanks, that's all.",THANK_YOU
"Thanks, that's all.",GOODBYE
"It's my friend's birthday and I want to take them to Aquitaine in SF, can you book me a reservation?",INFORM
"Book the reservation for 12 o""clock in the afternoon",INFORM
"That's incorrect, I was it to be on the 14th of this month.",INFORM
"That's incorrect, I was it to be on the 14th of this month.",NEGATE
Yes that works great,AFFIRM
Will there be live music? What is their phone number?,REQUEST
Thank you!,THANK_YOU
Thank you!,GOODBYE
"No that will be all, thank you.",THANK_YOU
"No that will be all, thank you.",NEGATE
I want to get a reservation in Berkeley.,INFORM
6:15 in the evening at Bistro liaison.,INFORM
yeah. what do they serve?,AFFIRM
yeah. what do they serve?,REQUEST
yes that's fine,AFFIRM
thanks,THANK_YOU
no. I'm good.,THANK_YOU
no. I'm good.,NEGATE
I want to reserve a table at a restaurant.,INFORM
I'd prefer the Lark restaurant in San Fran at five in the evening.,INFORM
That sounds great. Can I know their address? Do they serve Spicy Indian food?,AFFIRM
That sounds great. Can I know their address? Do they serve Spicy Indian food?,REQUEST
"Yes, let's try that.",AFFIRM
Thank you very much. That is all I need for now.,THANK_YOU
Thank you very much. That is all I need for now.,GOODBYE
I want to book the Taste of Burma restaurant for 2 persons. Can you help me?,INFORM
I need to book it at quarter past 7 in the evening in Daly City.,INFORM
"Yes, that is correct. Please make it.",AFFIRM
"Yes, please check.",AFFIRM
Can you help me make a reservation at 1:15 pm in Concord?,INFORM
"Agave Grill please, for March 10th",INFORM
Yes that's fine,AFFIRM
Thanks for your help,THANK_YOU
No that's all for now,THANK_YOU
No that's all for now,NEGATE
Can you reserve a table for me?,INFORM
I want SF. I want to eat at Crazy Pepper. Schedule fo night 8.,INFORM
No. I have 3 people.,INFORM
No. I have 3 people.,NEGATE
Got it. That's what I want.,AFFIRM
"Ok, well try Taste of the Himalayas.",INFORM
"Yes, correct. Can you tell if they have Taiwanese food?",AFFIRM
"Yes, correct. Can you tell if they have Taiwanese food?",REQUEST
"No, that's quite enough.",THANK_YOU
"No, that's quite enough.",NEGATE
I'd like to book a spot at a diner.,INFORM
I'd like to have it in Hayward at evening 5.,INFORM
The diner is called Paya.,INFORM
"Nope, I'd like to have it in Cotati, and the diner is China Chef.",INFORM
"Nope, I'd like to have it in Cotati, and the diner is China Chef.",NEGATE
"Yeah, that's perfect for me.",AFFIRM
Thank you for your assistance.,THANK_YOU
Thank you for your assistance.,GOODBYE
"No, thank you for your assistance.",THANK_YOU
"No, thank you for your assistance.",NEGATE
I would like to make reservations for 2 at Pescatore.,INFORM
"A quarter to 1 in the afternoon, please.",INFORM
I would like the reservation in SFO.,INFORM
"Yes, that is correct.",AFFIRM
"Yes, that will be fine.",AFFIRM
Do they have live music and could you provide me with their contact number?,REQUEST
Thank you so much.,THANK_YOU
"No, that is all. Thank you.",THANK_YOU
"No, that is all. Thank you.",NEGATE
"Please make me a reservation on 9th of this month, at seven pm",INFORM
"Yes, the State Bird in SFO",INFORM
Yes that fine,AFFIRM
"Thats all i want, thanks",THANK_YOU
"Thats all i want, thanks",GOODBYE
I want to make a reservation at a restaurant on 10th of march in san fran.,INFORM
The restaurant is thanh long at 1:15 in the afternoon.,INFORM
"yes, that works for me",AFFIRM
yes that works for me.,AFFIRM
thanks a lot,THANK_YOU
thanks a lot,GOODBYE
Can you find me a restaurant so that I can make a reservation?,INFORM
The place is Cupertino. Make a reservation at Yayoi and the time is quarter to 8 in the evening.,INFORM
Yes that's correct. Do they serve liquor?,AFFIRM
Yes that's correct. Do they serve liquor?,REQUEST
Please try booking again in The Mexican restaurant at 18:45,INFORM
Can you change the city to Hayward?,INFORM
Can you change the city to Hayward?,NEGATE
Yes perfect.,AFFIRM
Thanks a lot,THANK_YOU
Thanks a lot,GOODBYE
My Anniversary is coming up. Can you find me a restaurant has reservations available on the 10th of this month?,INFORM
"We would like to make reservations for two at 18:00, at the Pub Republic in Petaluma.",INFORM
"Yes, thank you, Can you give me the address to the restaurant? I was wondering what kind of prices do they have?",AFFIRM
"Yes, thank you, Can you give me the address to the restaurant? I was wondering what kind of prices do they have?",REQUEST
Thank you so very much.,THANK_YOU
No. Thank you very much.,THANK_YOU
No. Thank you very much.,NEGATE
I would like to make a restaurant reservation.,INFORM
I would like to search in Alameda. The restaurant's name is Angel Fish. Please reserve it for twelve pm.,INFORM
"Yes, perfect!",AFFIRM
May I know their address?,REQUEST
Does the restaurant play live music? And does it serve Burger types of food?,REQUEST
"Thank you, that it all.",THANK_YOU
"Thank you, that it all.",GOODBYE
"Yes, it's called Juerga.",INFORM
It's in San Jose. Make the reservation for 10:45 in the morning.,INFORM
"Actually, I want to go to Lotus Cuisine in San Rafael.",INFORM
"Actually, I want to go to Lotus Cuisine in San Rafael.",NEGATE
"Yes, that's it.",AFFIRM
"No, that's it.",THANK_YOU
"No, that's it.",NEGATE
"Hi, I'm interested in making a restaurant reservation.",INFORM
Please reserve it for 7 in the evening.,INFORM
"Yes, I'm interested in a restaurant called Maruya and this will be for three people.",INFORM
I'm looking in SFO in particular and I have open availability for the date.,INFORM
"No, that's not correct it's for four people.",INFORM
"No, that's not correct it's for four people.",NEGATE
"No, please reschedule for 2nd of March.",INFORM
"No, please reschedule for 2nd of March.",NEGATE
"Perfect, all set.",AFFIRM
"Yes, I want a reservation for twelve pm at a restaurant.",INFORM
"Correct, thanks.",AFFIRM
"Perfect, that's all for now.",THANK_YOU
"Perfect, that's all for now.",GOODBYE
"Listen up, my friend. My co-worker and I want to celebrate the end of this tough project. Please use your magic to help me make a reservation for two at a nice restaurant.",INFORM
"Let's go for Fairfield, please?",INFORM
Let's do Mcdonald's at six in the evening on any day coming up.,INFORM
"Yes, that's great to set up. But, tell me, is this going to be kind of over-priced? And, what is the phone number there?",AFFIRM
"Yes, that's great to set up. But, tell me, is this going to be kind of over-priced? And, what is the phone number there?",REQUEST
Nice. Your assistance is highly appreciated.,THANK_YOU
I think not. Thanks for your diligence.,THANK_YOU
I think not. Thanks for your diligence.,NEGATE
I like the restaurant Kampai Bar. I would like the reservation on the 13th of this month at 6:30 in the evening.,INFORM
San Jose is my preferred location.,INFORM
"That is correct. Can you give me the restaurant address? Also, do they have live music.",AFFIRM
"That is correct. Can you give me the restaurant address? Also, do they have live music.",REQUEST
Thanks for the assistance.,THANK_YOU
Thanks for the assistance.,GOODBYE
No thank you.,THANK_YOU
No thank you.,NEGATE
No thank you.,GOODBYE
I wish to make a reservation at a restaurant in Pleasant Hill.,INFORM
I want the restaurant to be Kobe for Saturday this week at afternoon 1:30.,INFORM
That is not correct. I want the reservation to be at Homestead in Oakland.,INFORM
That is not correct. I want the reservation to be at Homestead in Oakland.,NEGATE
That is correct. Can you tell me what the address is and if they serve Burger dishes?,AFFIRM
That is correct. Can you tell me what the address is and if they serve Burger dishes?,REQUEST
Thank you for providing me with that information. That's all the help I need.,THANK_YOU
Thank you for providing me with that information. That's all the help I need.,GOODBYE
Please make me a reservation at the Bear Republic restaurant,INFORM
In Rohnert Park for 19:00 hours,INFORM
Yes that's right,AFFIRM
"Hello, Good morning!!! I wish to go out for dinner today. Can you make a dinner reservation at a good restaurant?",INFORM
Probably by 6:30 pm.,INFORM
"Yup! I would prefer a Mexican restaurant, the Crab House.",INFORM
I would prefer SF.,INFORM
"Nope, sorry please can you make it on the 13th in Sunnyvale?",INFORM
"Nope, sorry please can you make it on the 13th in Sunnyvale?",NEGATE
Yup! sounds good.,AFFIRM
"Nope, thanks a lot.",THANK_YOU
"Nope, thanks a lot.",NEGATE
Make me a reservation at a restaurant please,INFORM
Yes I would like to be in Oakland at restaurant Sukho on the 8th at 17:00,INFORM
Yes perfect.Liquor they serve?,AFFIRM
Yes perfect.Liquor they serve?,REQUEST
Thank you for your help.,THANK_YOU
No.Thanks.,THANK_YOU
No.Thanks.,NEGATE
I would like to make a 4:45 pm restuarant reservation.,INFORM
"Yes, please look for the Burma Ruby restaurant in Palo Alto.",INFORM
That is correct. What is the restaurant's adddress and what is the price range?,AFFIRM
That is correct. What is the restaurant's adddress and what is the price range?,REQUEST
Not at this time.,THANK_YOU
Not at this time.,NEGATE
"I want to reserve a table at 7:45 in the evening, in a restaurant.",INFORM
I need a table for one at the El Rancho restaurant in Concord.,INFORM
"Yes, please. Can I have their contact number?",AFFIRM
"Yes, please. Can I have their contact number?",REQUEST
Do they have live music?,REQUEST
No. Thank you. That's all I need for now.,THANK_YOU
No. Thank you. That's all I need for now.,NEGATE
Make a reservation in Dynasty restaurant for two people.,INFORM
In San Jose on 12th of March at quarter past 7 in the evening.,INFORM
Yeah exactly.,AFFIRM
"No, that doesn't work for me",NEGATE
No. Thank you very much,THANK_YOU
No. Thank you very much,NEGATE
i want to booking a restaurant for 2 people,INFORM
i want san jose in village at 11:30 in the morning,INFORM
no. it is for three people,INFORM
no. it is for three people,NEGATE
"yes that works for me. how pricey are they, do they serve liquor",AFFIRM
"yes that works for me. how pricey are they, do they serve liquor",REQUEST
thanks you very much,THANK_YOU
no. thank you for your help,THANK_YOU
no. thank you for your help,NEGATE
Can I make a restaurant reservation? I want it on March 12th.,INFORM
"The restaurant is Tao San Jin. Please make it for 2 o""clock in the afternoon.",INFORM
I want it in Antioch.,INFORM
Yes that works for me. What is the address?,AFFIRM
Yes that works for me. What is the address?,REQUEST
I want to try again. The restaurant is Khana Peena.,INFORM
No. Can I change it to the 9th of March in Berkeley.,INFORM
No. Can I change it to the 9th of March in Berkeley.,NEGATE
No. Make it at 12 in the afternoon.,INFORM
No. Make it at 12 in the afternoon.,NEGATE
Yes that works for me.,AFFIRM
"No, that is all thank you.",THANK_YOU
"No, that is all thank you.",NEGATE
I'd like to make a restaurant reservation at quarter to 7 in the evening.,INFORM
I want to go to Sushi Omakase in Gilroy.,INFORM
Sounds right. What kind of food do they have there?,AFFIRM
Sounds right. What kind of food do they have there?,REQUEST
"No, not right now.",NEGATE
"No, not right now.",GOODBYE
I'd like to book a spot at a diner. I'd like to have it on the 8th of this month for 1 person.,INFORM
I'd like to have it in Milpitas at 1:30 in the afternoon.,INFORM
The diner is Darda.,INFORM
"Yeah, that's perfect for me. Do they offer alcohol and Spicy Indian food?",AFFIRM
"Yeah, that's perfect for me. Do they offer alcohol and Spicy Indian food?",REQUEST
Thank you for your assistance; that's all.,THANK_YOU
Thank you for your assistance; that's all.,GOODBYE
I won't have time to make dinner after my big meeting so I would like to make a dinner reservation.,INFORM
"Can you make the reservation for 1 at Katsu, located in Los Gatos, for six in the evening, on the 12th of this month?",INFORM
"Yes, that sound great. I can't wait.",AFFIRM
"Thanks, that's one less thing I have to do.",THANK_YOU
"No, that will be all and thank you again.",THANK_YOU
"No, that will be all and thank you again.",NEGATE
I want to make a reservation for this evening 7.,INFORM
"Make it at Mister Jiu's in SFO. Also, it should be noted the reservation is only for 1 person.",INFORM
"Yes, I don't necessarily need a whole table but I think they will understand.",AFFIRM
"Yeah, I guess that will work.",AFFIRM
I will. Thank you very much.,THANK_YOU
I will. Thank you very much.,GOODBYE
I'd like to make a booking at a restaurant.,INFORM
I want to book a table at Khana Peena in Berkeley at afternoon 1:30.,INFORM
Yeah that's perfect. Where is the restaurant? What type of food do they serve?,AFFIRM
Yeah that's perfect. Where is the restaurant? What type of food do they serve?,REQUEST
"Thanks a lot, that'll be all.",THANK_YOU
"Thanks a lot, that'll be all.",GOODBYE
I want booking at a restaurant on the 7th in SF,INFORM
I am interested in Oneup at quarter to 5 in the evening,INFORM
No the restaurant should be Bombay to Goa at 17:30,INFORM
No the restaurant should be Bombay to Goa at 17:30,NEGATE
That is perfect. Do they provide liquor and live music?,AFFIRM
That is perfect. Do they provide liquor and live music?,REQUEST
Please try reserving again on the 7th,INFORM
This is good for me,AFFIRM
No thank you,THANK_YOU
No thank you,NEGATE
Can you help me make a reservation for a restaurant for a date?,INFORM
I'm looking for Anchor & Hope.,INFORM
I want to make it for two people at one in the afternoon in San Francisco.,INFORM
That works for me.,AFFIRM
"No, thanks a lot.",THANK_YOU
"No, thanks a lot.",NEGATE
I'd like to make reservations at a restaurant.,INFORM
In San Rafael for the 5th of this month.,INFORM
At 1 pm please.,INFORM
A restaurant called Rangecafe.,INFORM
"Yes, that works for me.",SELECT
"Yes, that works for me.",AFFIRM
Do they serve liquor or have live music?,REQUEST
No. Thank you.,THANK_YOU
No. Thank you.,NEGATE
I would like to make a restaurant reservation in San Jose.,INFORM
The restaurant is Spencer's.,INFORM
Please make it on the 3rd of MArch at quarter past 1 in the afternoon.,INFORM
Yes. Are they considered intermediate priced?,AFFIRM
Yes. Are they considered intermediate priced?,REQUEST
Thank you for your assitance.,THANK_YOU
"No, thank you for your help.",THANK_YOU
"No, thank you for your help.",NEGATE
I want to make a reservation at restaurant Hisui 2.,INFORM
"I would like to be at 8 o""clock in the night.",INFORM
In Vacaville I want to be,INFORM
No.Red Jade is the restaurant.,INFORM
No.Red Jade is the restaurant.,NEGATE
Yes is good .Tell me please their address,AFFIRM
Yes is good .Tell me please their address,REQUEST
Try please make the booking again at 7:45 in the evening,INFORM
Yes is perfect.You can tell me please what type of food is available and if they have live music?,AFFIRM
Yes is perfect.You can tell me please what type of food is available and if they have live music?,REQUEST
"No,it s ok.Thnak you!",THANK_YOU
"No,it s ok.Thnak you!",NEGATE
I would like to make a reservation to a restaurant for 5 pm.,INFORM
"Yes, the restaurant is called Sociale and it will be for the one located in San Fran.",INFORM
"Yes, that sounds great. Could I also have their contact number, please?",AFFIRM
"Yes, that sounds great. Could I also have their contact number, please?",REQUEST
"No, not at this time.",NEGATE
"No, Thank you for your help.",THANK_YOU
"No, Thank you for your help.",NEGATE
I'm going out tonight and need to make a restaurant reservation.,INFORM
Make the reservation in SF at 11:30 in the morning.,INFORM
It is called Will. I only need a reservation for one.,INFORM
Actually change it to eleven in the morning.,INFORM
Actually change it to eleven in the morning.,NEGATE
"No, I'd like it next Monday.",INFORM
"No, I'd like it next Monday.",NEGATE
Yes that's fine.,AFFIRM
Yes that's ok.,AFFIRM
Can you check it they have live music?,REQUEST
How expensive is the restaurant? And can you find their phone number?,REQUEST
"Thanks, that will be all.",THANK_YOU
"Thanks, that will be all.",GOODBYE
I need help with making a restaurant reservation.,INFORM
"It's a restaurant called Yum Yum, and it's for six pm.",INFORM
It's in San Fran.,INFORM
"Yeah, that's correct. Are the prices costly there?",AFFIRM
"Yeah, that's correct. Are the prices costly there?",REQUEST
"Thanks a lot, I won't be needing any more help.",THANK_YOU
"Thanks a lot, I won't be needing any more help.",GOODBYE
I want to make reservations at Stella Alpina Osteria,INFORM
I would like my reservation for the 12th at half past 7 in the evening,INFORM
I want to dine at Stella in Burlingame,INFORM
Yes thanks so much,AFFIRM
Can I please get the address and is it average priced,REQUEST
Thanks for all of that. That is it for me,THANK_YOU
Thanks for all of that. That is it for me,GOODBYE
Please help me to make a reservation at a place to eat.,INFORM
We want to eat at the Claw Shack in San Jose. Please make the reservation for 11:30 am.,INFORM
"I'd prefer to eat at the 3rd Cousin, and the reservation will need to be for four people.",INFORM
"I'd prefer to eat at the 3rd Cousin, and the reservation will need to be for four people.",NEGATE
"Yes, that would be very helpful.",AFFIRM
"No, but thank you.",THANK_YOU
"No, but thank you.",NEGATE
I hear Hunan Impression has great food. I'd like to make a reservation for it.,INFORM
"I'd like my reservation to be in San Jose, and at morning 11.",INFORM
"Actually, I need some more time to prepare. I instead want it in SFO on the 14th of this month.",INFORM
"Actually, I need some more time to prepare. I instead want it in SFO on the 14th of this month.",NEGATE
"Let me attempt to book Hunan Impression again. Let's instead for with the 5th of this month, at evening 5:30.",INFORM
"Indeed, that all sounds good.",AFFIRM
"I'll give up on booking a table for now. Thanks for the help, though.",THANK_YOU
"I'll give up on booking a table for now. Thanks for the help, though.",NEGATE
I want to make a restaurant reservation please.,INFORM
I'm thinking 5:15 pm.,INFORM
I would like it in Danville.,INFORM
I like Luna Loca and I would like it for the 6th of this month.,INFORM
Yes that is perfect. How expensive is the restaurant?,AFFIRM
Yes that is perfect. How expensive is the restaurant?,REQUEST
"Hi, I'd like to go out and eat with some friends. Can you book a restaurant reservation for 6:30 pm?",INFORM
I'd like to go to Golden Harvest in St. Helena.,INFORM
"Yes, that's perfect.",AFFIRM
"Thanks for everything, that will be all.",THANK_YOU
"Thanks for everything, that will be all.",GOODBYE
I want to reserve a table at Cafe Vitale at 19:00.,INFORM
It's in Los Altos.,INFORM
"Yes, that sounds perfect.",AFFIRM
Thank you for the assistance.,THANK_YOU
No. Thank you. That'll be all.,THANK_YOU
No. Thank you. That'll be all.,NEGATE
I need to reserve a table.,INFORM
The evening 6:45.,INFORM
I could go for some Taco Bell.,INFORM
Try the one in Pleasanton.,INFORM
"You got it. Hey, do they have Noodles? What's the price range?",AFFIRM
"You got it. Hey, do they have Noodles? What's the price range?",REQUEST
"No, don't bother. I'm set.",NEGATE
"No, don't bother. I'm set.",GOODBYE
"Hi, I would like to make a restaurant reservation for 3 people.",INFORM
"Please make a reservation at six pm in San Fran, at La Laguna.",INFORM
Thanks very much. That's all I needed!,THANK_YOU
Thanks very much. That's all I needed!,GOODBYE
I would like to make a reservation at the restaurant Anar.,INFORM
San Fran.,INFORM
Make it for 12 pm.,INFORM
"No, I would like the reservation to be for three people.",INFORM
"No, I would like the reservation to be for three people.",NEGATE
"No, the name of the restaurant is El Amigo and it is for 1 person.",INFORM
"No, the name of the restaurant is El Amigo and it is for 1 person.",NEGATE
Yes that is correct. Are the prices inexpensive and do they have live music?,AFFIRM
Yes that is correct. Are the prices inexpensive and do they have live music?,REQUEST
I want to make a reservation at a restaurant for 17:00.,INFORM
Yes that is correct.,AFFIRM
"No, thank you.",THANK_YOU
"No, thank you.",NEGATE
I'd like to make a reservation for 2 at Milpitas.,INFORM
How about 17:30?,INFORM
I like Ta restaurant.,INFORM
"Yes, that sounds good. Where is the restaurant located? Can I get their phone number?",AFFIRM
"Yes, that sounds good. Where is the restaurant located? Can I get their phone number?",REQUEST
Thanks! That is all I need for now.,THANK_YOU
Thanks! That is all I need for now.,GOODBYE
Please help me make a restaurant reservation for later today.,INFORM
"I need something in Petaluma for 3 people, at six in the evening.",INFORM
Please make it at Lemongrass.,INFORM
"Yes, that's it. What is the street address for Lemongrass? Also, what type of food is on their menu?",AFFIRM
"Yes, that's it. What is the street address for Lemongrass? Also, what type of food is on their menu?",REQUEST
"Thanks, that is all I needed.",THANK_YOU
"Thanks, that is all I needed.",GOODBYE
I'l like to reserve a table at a restaurant for 6 people.,INFORM
I'd like to make a reservation for the 14th of this month at Mendoza's in San Jose for 7:30 in the evening.,INFORM
That's fine. How expensive is the restaurant?,AFFIRM
That's fine. How expensive is the restaurant?,REQUEST
"Thanks, that's everything for now.",THANK_YOU
"Thanks, that's everything for now.",GOODBYE
I would like to make a restaurant reservation for three people.,INFORM
Can you make me a reservation at Carnitas Michoacan in Gilroy at 11:15 am. Any day will work for me.,INFORM
"Yes that works for me. Do you know if they serve liquor? Also, can i get the contact number please?",AFFIRM
"Yes that works for me. Do you know if they serve liquor? Also, can i get the contact number please?",REQUEST
"No thanks, that will be all.",NEGATE
"No thanks, that will be all.",GOODBYE
I want a restaurant in Mountain View about half past 1 in the afternoon.,INFORM
I like the restaurant Paul Martin's.,INFORM
"Yes, that is great. Can you give me the restaurant address.",AFFIRM
"Yes, that is great. Can you give me the restaurant address.",REQUEST
What is the restaurant's price range? Do they serve alcohol?,REQUEST
I'd like to make a reservation for a restaurant.,INFORM
I'd like to make a reservation for 4 at Sumac in Belmont at half past 5 in the evening.,INFORM
Sure that sounds good.,AFFIRM
How pricey is the place?,REQUEST
"Thanks, that's all i need.",THANK_YOU
"Thanks, that's all i need.",GOODBYE
